"No.","Time","Source","Destination","Protocol","Length","Info"
"1","0.000000000","127.0.0.1","127.0.0.1","TCP","74","59334  >  5000 [SYN] Seq=0 Win=65495 Len=0 MSS=65495 SACK_PERM TSval=2438767606 TSecr=0 WS=128"
"2","0.000018167","127.0.0.1","127.0.0.1","TCP","74","5000  >  59334 [SYN, ACK] Seq=0 Ack=1 Win=65483 Len=0 MSS=65495 SACK_PERM TSval=2438767606 TSecr=2438767606 WS=128"
"3","0.000043292","127.0.0.1","127.0.0.1","TCP","66","59334  >  5000 [ACK] Seq=1 Ack=1 Win=65536 Len=0 TSval=2438767606 TSecr=2438767606"
"4","0.000149167","127.0.0.1","127.0.0.1","TCP","106","59334  >  5000 [PSH, ACK] Seq=1 Ack=1 Win=65536 Len=40 TSval=2438767606 TSecr=2438767606"
"5","0.000153208","127.0.0.1","127.0.0.1","TCP","66","5000  >  59334 [ACK] Seq=1 Ack=41 Win=65536 Len=0 TSval=2438767606 TSecr=2438767606"
"6","1.000884280","127.0.0.1","127.0.0.1","TCP","106","59334  >  5000 [PSH, ACK] Seq=41 Ack=1 Win=65536 Len=40 TSval=2438768607 TSecr=2438767606"
"7","1.000896238","127.0.0.1","127.0.0.1","TCP","66","5000  >  59334 [ACK] Seq=1 Ack=81 Win=65536 Len=0 TSval=2438768607 TSecr=2438768607"
"8","2.002214102","127.0.0.1","127.0.0.1","TCP","106","59334  >  5000 [PSH, ACK] Seq=81 Ack=1 Win=65536 Len=40 TSval=2438769608 TSecr=2438768607"
"9","2.002262061","127.0.0.1","127.0.0.1","TCP","66","5000  >  59334 [ACK] Seq=1 Ack=121 Win=65536 Len=0 TSval=2438769608 TSecr=2438769608"
"10","3.004819010","127.0.0.1","127.0.0.1","TCP","106","59334  >  5000 [PSH, ACK] Seq=121 Ack=1 Win=65536 Len=40 TSval=2438770611 TSecr=2438769608"
"11","3.004873760","127.0.0.1","127.0.0.1","TCP","66","5000  >  59334 [ACK] Seq=1 Ack=161 Win=65536 Len=0 TSval=2438770611 TSecr=2438770611"
"12","4.008655793","127.0.0.1","127.0.0.1","TCP","106","59334  >  5000 [PSH, ACK] Seq=161 Ack=1 Win=65536 Len=40 TSval=2438771615 TSecr=2438770611"
"13","4.008727335","127.0.0.1","127.0.0.1","TCP","66","5000  >  59334 [ACK] Seq=1 Ack=201 Win=65536 Len=0 TSval=2438771615 TSecr=2438771615"
"14","5.012848411","127.0.0.1","127.0.0.1","TCP","106","59334  >  5000 [PSH, ACK] Seq=201 Ack=1 Win=65536 Len=40 TSval=2438772619 TSecr=2438771615"
"15","5.012922494","127.0.0.1","127.0.0.1","TCP","66","5000  >  59334 [ACK] Seq=1 Ack=241 Win=65536 Len=0 TSval=2438772619 TSecr=2438772619"
"16","6.016148777","127.0.0.1","127.0.0.1","TCP","106","59334  >  5000 [PSH, ACK] Seq=241 Ack=1 Win=65536 Len=40 TSval=2438773622 TSecr=2438772619"
"17","6.016223194","127.0.0.1","127.0.0.1","TCP","66","5000  >  59334 [ACK] Seq=1 Ack=281 Win=65536 Len=0 TSval=2438773622 TSecr=2438773622"
"18","7.016802141","127.0.0.1","127.0.0.1","TCP","106","59334  >  5000 [PSH, ACK] Seq=281 Ack=1 Win=65536 Len=40 TSval=2438774623 TSecr=2438773622"
"19","7.016842349","127.0.0.1","127.0.0.1","TCP","66","5000  >  59334 [ACK] Seq=1 Ack=321 Win=65536 Len=0 TSval=2438774623 TSecr=2438774623"
"20","8.020711799","127.0.0.1","127.0.0.1","TCP","106","59334  >  5000 [PSH, ACK] Seq=321 Ack=1 Win=65536 Len=40 TSval=2438775627 TSecr=2438774623"
"21","8.020770674","127.0.0.1","127.0.0.1","TCP","66","5000  >  59334 [ACK] Seq=1 Ack=361 Win=65536 Len=0 TSval=2438775627 TSecr=2438775627"
"22","9.021469871","127.0.0.1","127.0.0.1","TCP","106","59334  >  5000 [PSH, ACK] Seq=361 Ack=1 Win=65536 Len=40 TSval=2438776628 TSecr=2438775627"
"23","9.021542871","127.0.0.1","127.0.0.1","TCP","66","5000  >  59334 [ACK] Seq=1 Ack=401 Win=65536 Len=0 TSval=2438776628 TSecr=2438776628"
"24","10.021671609","127.0.0.1","127.0.0.1","TCP","106","59334  >  5000 [PSH, ACK] Seq=401 Ack=1 Win=65536 Len=40 TSval=2438777628 TSecr=2438776628"
"25","10.021686984","127.0.0.1","127.0.0.1","TCP","66","5000  >  59334 [ACK] Seq=1 Ack=441 Win=65536 Len=0 TSval=2438777628 TSecr=2438777628"
"26","11.025808977","127.0.0.1","127.0.0.1","TCP","106","59334  >  5000 [PSH, ACK] Seq=441 Ack=1 Win=65536 Len=40 TSval=2438778632 TSecr=2438777628"
"27","11.025837977","127.0.0.1","127.0.0.1","TCP","66","5000  >  59334 [ACK] Seq=1 Ack=481 Win=65536 Len=0 TSval=2438778632 TSecr=2438778632"
"28","12.029277135","127.0.0.1","127.0.0.1","TCP","106","59334  >  5000 [PSH, ACK] Seq=481 Ack=1 Win=65536 Len=40 TSval=2438779636 TSecr=2438778632"
"29","12.029316427","127.0.0.1","127.0.0.1","TCP","66","5000  >  59334 [ACK] Seq=1 Ack=521 Win=65536 Len=0 TSval=2438779636 TSecr=2438779636"
"30","13.033901711","127.0.0.1","127.0.0.1","TCP","106","59334  >  5000 [PSH, ACK] Seq=521 Ack=1 Win=65536 Len=40 TSval=2438780640 TSecr=2438779636"
"31","13.033930461","127.0.0.1","127.0.0.1","TCP","66","5000  >  59334 [ACK] Seq=1 Ack=561 Win=65536 Len=0 TSval=2438780640 TSecr=2438780640"
"32","14.034050366","127.0.0.1","127.0.0.1","TCP","106","59334  >  5000 [PSH, ACK] Seq=561 Ack=1 Win=65536 Len=40 TSval=2438781640 TSecr=2438780640"
"33","14.034067074","127.0.0.1","127.0.0.1","TCP","66","5000  >  59334 [ACK] Seq=1 Ack=601 Win=65536 Len=0 TSval=2438781640 TSecr=2438781640"
"34","15.035924856","127.0.0.1","127.0.0.1","TCP","106","59334  >  5000 [PSH, ACK] Seq=601 Ack=1 Win=65536 Len=40 TSval=2438782642 TSecr=2438781640"
"35","15.036132148","127.0.0.1","127.0.0.1","TCP","66","5000  >  59334 [ACK] Seq=1 Ack=641 Win=65536 Len=0 TSval=2438782642 TSecr=2438782642"
"36","16.036759511","127.0.0.1","127.0.0.1","TCP","106","59334  >  5000 [PSH, ACK] Seq=641 Ack=1 Win=65536 Len=40 TSval=2438783643 TSecr=2438782642"
"37","16.036772178","127.0.0.1","127.0.0.1","TCP","66","5000  >  59334 [ACK] Seq=1 Ack=681 Win=65536 Len=0 TSval=2438783643 TSecr=2438783643"
"38","17.040243420","127.0.0.1","127.0.0.1","TCP","106","59334  >  5000 [PSH, ACK] Seq=681 Ack=1 Win=65536 Len=40 TSval=2438784646 TSecr=2438783643"
"39","17.040326628","127.0.0.1","127.0.0.1","TCP","66","5000  >  59334 [ACK] Seq=1 Ack=721 Win=65536 Len=0 TSval=2438784647 TSecr=2438784646"
"40","18.044579787","127.0.0.1","127.0.0.1","TCP","106","59334  >  5000 [PSH, ACK] Seq=721 Ack=1 Win=65536 Len=40 TSval=2438785651 TSecr=2438784647"
"41","18.044636829","127.0.0.1","127.0.0.1","TCP","66","5000  >  59334 [ACK] Seq=1 Ack=761 Win=65536 Len=0 TSval=2438785651 TSecr=2438785651"
"42","19.044787484","127.0.0.1","127.0.0.1","TCP","106","59334  >  5000 [PSH, ACK] Seq=761 Ack=1 Win=65536 Len=40 TSval=2438786651 TSecr=2438785651"
"43","19.044806775","127.0.0.1","127.0.0.1","TCP","66","5000  >  59334 [ACK] Seq=1 Ack=801 Win=65536 Len=0 TSval=2438786651 TSecr=2438786651"
"44","20.045523264","127.0.0.1","127.0.0.1","TCP","106","59334  >  5000 [PSH, ACK] Seq=801 Ack=1 Win=65536 Len=40 TSval=2438787652 TSecr=2438786651"
"45","20.045560014","127.0.0.1","127.0.0.1","TCP","66","5000  >  59334 [ACK] Seq=1 Ack=841 Win=65536 Len=0 TSval=2438787652 TSecr=2438787652"
"46","21.047045837","127.0.0.1","127.0.0.1","TCP","106","59334  >  5000 [PSH, ACK] Seq=841 Ack=1 Win=65536 Len=40 TSval=2438788653 TSecr=2438787652"
"47","21.047142879","127.0.0.1","127.0.0.1","TCP","66","5000  >  59334 [ACK] Seq=1 Ack=881 Win=65536 Len=0 TSval=2438788653 TSecr=2438788653"
"48","22.051794039","127.0.0.1","127.0.0.1","TCP","106","59334  >  5000 [PSH, ACK] Seq=881 Ack=1 Win=65536 Len=40 TSval=2438789658 TSecr=2438788653"
"49","22.051826372","127.0.0.1","127.0.0.1","TCP","66","5000  >  59334 [ACK] Seq=1 Ack=921 Win=65536 Len=0 TSval=2438789658 TSecr=2438789658"
"50","23.052188360","127.0.0.1","127.0.0.1","TCP","106","59334  >  5000 [PSH, ACK] Seq=921 Ack=1 Win=65536 Len=40 TSval=2438790658 TSecr=2438789658"
"51","23.052211860","127.0.0.1","127.0.0.1","TCP","66","5000  >  59334 [ACK] Seq=1 Ack=961 Win=65536 Len=0 TSval=2438790658 TSecr=2438790658"
"52","24.053575350","127.0.0.1","127.0.0.1","TCP","106","59334  >  5000 [PSH, ACK] Seq=961 Ack=1 Win=65536 Len=40 TSval=2438791660 TSecr=2438790658"
"53","24.053612475","127.0.0.1","127.0.0.1","TCP","66","5000  >  59334 [ACK] Seq=1 Ack=1001 Win=65536 Len=0 TSval=2438791660 TSecr=2438791660"
"54","25.057665759","127.0.0.1","127.0.0.1","TCP","106","59334  >  5000 [PSH, ACK] Seq=1001 Ack=1 Win=65536 Len=40 TSval=2438792664 TSecr=2438791660"
"55","25.057755384","127.0.0.1","127.0.0.1","TCP","66","5000  >  59334 [ACK] Seq=1 Ack=1041 Win=65536 Len=0 TSval=2438792664 TSecr=2438792664"
"56","26.058368789","127.0.0.1","127.0.0.1","TCP","106","59334  >  5000 [PSH, ACK] Seq=1041 Ack=1 Win=65536 Len=40 TSval=2438793665 TSecr=2438792664"
"57","26.058447081","127.0.0.1","127.0.0.1","TCP","66","5000  >  59334 [ACK] Seq=1 Ack=1081 Win=65536 Len=0 TSval=2438793665 TSecr=2438793665"
"58","27.062897074","127.0.0.1","127.0.0.1","TCP","106","59334  >  5000 [PSH, ACK] Seq=1081 Ack=1 Win=65536 Len=40 TSval=2438794669 TSecr=2438793665"
"59","27.062984699","127.0.0.1","127.0.0.1","TCP","66","5000  >  59334 [ACK] Seq=1 Ack=1121 Win=65536 Len=0 TSval=2438794669 TSecr=2438794669"
"60","28.063189604","127.0.0.1","127.0.0.1","TCP","106","59334  >  5000 [PSH, ACK] Seq=1121 Ack=1 Win=65536 Len=40 TSval=2438795669 TSecr=2438794669"
"61","28.063210437","127.0.0.1","127.0.0.1","TCP","66","5000  >  59334 [ACK] Seq=1 Ack=1161 Win=65536 Len=0 TSval=2438795669 TSecr=2438795669"
"62","29.064568052","127.0.0.1","127.0.0.1","TCP","106","59334  >  5000 [PSH, ACK] Seq=1161 Ack=1 Win=65536 Len=40 TSval=2438796671 TSecr=2438795669"
"63","29.064628760","127.0.0.1","127.0.0.1","TCP","66","5000  >  59334 [ACK] Seq=1 Ack=1201 Win=65536 Len=0 TSval=2438796671 TSecr=2438796671"
"64","30.066915959","127.0.0.1","127.0.0.1","TCP","106","59334  >  5000 [PSH, ACK] Seq=1201 Ack=1 Win=65536 Len=40 TSval=2438797673 TSecr=2438796671"
"65","30.066960334","127.0.0.1","127.0.0.1","TCP","66","5000  >  59334 [ACK] Seq=1 Ack=1241 Win=65536 Len=0 TSval=2438797673 TSecr=2438797673"
"66","31.068572074","127.0.0.1","127.0.0.1","TCP","106","59334  >  5000 [PSH, ACK] Seq=1241 Ack=1 Win=65536 Len=40 TSval=2438798675 TSecr=2438797673"
"67","31.068660324","127.0.0.1","127.0.0.1","TCP","66","5000  >  59334 [ACK] Seq=1 Ack=1281 Win=65536 Len=0 TSval=2438798675 TSecr=2438798675"
"68","32.073139734","127.0.0.1","127.0.0.1","TCP","106","59334  >  5000 [PSH, ACK] Seq=1281 Ack=1 Win=65536 Len=40 TSval=2438799679 TSecr=2438798675"
"69","32.073217734","127.0.0.1","127.0.0.1","TCP","66","5000  >  59334 [ACK] Seq=1 Ack=1321 Win=65536 Len=0 TSval=2438799679 TSecr=2438799679"
"70","33.077898394","127.0.0.1","127.0.0.1","TCP","106","59334  >  5000 [PSH, ACK] Seq=1321 Ack=1 Win=65536 Len=40 TSval=2438800684 TSecr=2438799679"
"71","33.077969436","127.0.0.1","127.0.0.1","TCP","66","5000  >  59334 [ACK] Seq=1 Ack=1361 Win=65536 Len=0 TSval=2438800684 TSecr=2438800684"
"72","34.079379801","127.0.0.1","127.0.0.1","TCP","106","59334  >  5000 [PSH, ACK] Seq=1361 Ack=1 Win=65536 Len=40 TSval=2438801685 TSecr=2438800684"
"73","34.079405717","127.0.0.1","127.0.0.1","TCP","66","5000  >  59334 [ACK] Seq=1 Ack=1401 Win=65536 Len=0 TSval=2438801686 TSecr=2438801685"
"74","35.083572377","127.0.0.1","127.0.0.1","TCP","106","59334  >  5000 [PSH, ACK] Seq=1401 Ack=1 Win=65536 Len=40 TSval=2438802690 TSecr=2438801686"
"75","35.083636502","127.0.0.1","127.0.0.1","TCP","66","5000  >  59334 [ACK] Seq=1 Ack=1441 Win=65536 Len=0 TSval=2438802690 TSecr=2438802690"
"76","36.087600119","127.0.0.1","127.0.0.1","TCP","106","59334  >  5000 [PSH, ACK] Seq=1441 Ack=1 Win=65536 Len=40 TSval=2438803694 TSecr=2438802690"
"77","36.087674953","127.0.0.1","127.0.0.1","TCP","66","5000  >  59334 [ACK] Seq=1 Ack=1481 Win=65536 Len=0 TSval=2438803694 TSecr=2438803694"
"78","37.089830735","127.0.0.1","127.0.0.1","TCP","106","59334  >  5000 [PSH, ACK] Seq=1481 Ack=1 Win=65536 Len=40 TSval=2438804696 TSecr=2438803694"
"79","37.089891402","127.0.0.1","127.0.0.1","TCP","66","5000  >  59334 [ACK] Seq=1 Ack=1521 Win=65536 Len=0 TSval=2438804696 TSecr=2438804696"
"80","38.094596979","127.0.0.1","127.0.0.1","TCP","106","59334  >  5000 [PSH, ACK] Seq=1521 Ack=1 Win=65536 Len=40 TSval=2438805701 TSecr=2438804696"
"81","38.094670604","127.0.0.1","127.0.0.1","TCP","66","5000  >  59334 [ACK] Seq=1 Ack=1561 Win=65536 Len=0 TSval=2438805701 TSecr=2438805701"
"82","39.096016927","127.0.0.1","127.0.0.1","TCP","106","59334  >  5000 [PSH, ACK] Seq=1561 Ack=1 Win=65536 Len=40 TSval=2438806702 TSecr=2438805701"
"83","39.096087427","127.0.0.1","127.0.0.1","TCP","66","5000  >  59334 [ACK] Seq=1 Ack=1601 Win=65536 Len=0 TSval=2438806702 TSecr=2438806702"
"84","40.096395290","127.0.0.1","127.0.0.1","TCP","106","59334  >  5000 [PSH, ACK] Seq=1601 Ack=1 Win=65536 Len=40 TSval=2438807703 TSecr=2438806702"
"85","40.096455874","127.0.0.1","127.0.0.1","TCP","66","5000  >  59334 [ACK] Seq=1 Ack=1641 Win=65536 Len=0 TSval=2438807703 TSecr=2438807703"
"86","41.100512616","127.0.0.1","127.0.0.1","TCP","106","59334  >  5000 [PSH, ACK] Seq=1641 Ack=1 Win=65536 Len=40 TSval=2438808707 TSecr=2438807703"
"87","41.100586408","127.0.0.1","127.0.0.1","TCP","66","5000  >  59334 [ACK] Seq=1 Ack=1681 Win=65536 Len=0 TSval=2438808707 TSecr=2438808707"
"88","42.104338734","127.0.0.1","127.0.0.1","TCP","106","59334  >  5000 [PSH, ACK] Seq=1681 Ack=1 Win=65536 Len=40 TSval=2438809711 TSecr=2438808707"
"89","42.104413984","127.0.0.1","127.0.0.1","TCP","66","5000  >  59334 [ACK] Seq=1 Ack=1721 Win=65536 Len=0 TSval=2438809711 TSecr=2438809711"
"90","43.104729723","127.0.0.1","127.0.0.1","TCP","106","59334  >  5000 [PSH, ACK] Seq=1721 Ack=1 Win=65536 Len=40 TSval=2438810711 TSecr=2438809711"
"91","43.104802514","127.0.0.1","127.0.0.1","TCP","66","5000  >  59334 [ACK] Seq=1 Ack=1761 Win=65536 Len=0 TSval=2438810711 TSecr=2438810711"
"92","44.109315591","127.0.0.1","127.0.0.1","TCP","106","59334  >  5000 [PSH, ACK] Seq=1761 Ack=1 Win=65536 Len=40 TSval=2438811716 TSecr=2438810711"
"93","44.109436258","127.0.0.1","127.0.0.1","TCP","66","5000  >  59334 [ACK] Seq=1 Ack=1801 Win=65536 Len=0 TSval=2438811716 TSecr=2438811716"
"94","45.114373418","127.0.0.1","127.0.0.1","TCP","106","59334  >  5000 [PSH, ACK] Seq=1801 Ack=1 Win=65536 Len=40 TSval=2438812721 TSecr=2438811716"
"95","45.114430085","127.0.0.1","127.0.0.1","TCP","66","5000  >  59334 [ACK] Seq=1 Ack=1841 Win=65536 Len=0 TSval=2438812721 TSecr=2438812721"
"96","46.114865490","127.0.0.1","127.0.0.1","TCP","106","59334  >  5000 [PSH, ACK] Seq=1841 Ack=1 Win=65536 Len=40 TSval=2438813721 TSecr=2438812721"
"97","46.115555366","127.0.0.1","127.0.0.1","TCP","66","5000  >  59334 [ACK] Seq=1 Ack=1881 Win=65536 Len=0 TSval=2438813721 TSecr=2438813721"
"98","47.116339814","127.0.0.1","127.0.0.1","TCP","106","59334  >  5000 [PSH, ACK] Seq=1881 Ack=1 Win=65536 Len=40 TSval=2438814723 TSecr=2438813721"
"99","47.116387355","127.0.0.1","127.0.0.1","TCP","66","5000  >  59334 [ACK] Seq=1 Ack=1921 Win=65536 Len=0 TSval=2438814723 TSecr=2438814723"
"100","48.117154886","127.0.0.1","127.0.0.1","TCP","106","59334  >  5000 [PSH, ACK] Seq=1921 Ack=1 Win=65536 Len=40 TSval=2438815723 TSecr=2438814723"
"101","48.117209678","127.0.0.1","127.0.0.1","TCP","66","5000  >  59334 [ACK] Seq=1 Ack=1961 Win=65536 Len=0 TSval=2438815723 TSecr=2438815723"
"102","49.121015295","127.0.0.1","127.0.0.1","TCP","106","59334  >  5000 [PSH, ACK] Seq=1961 Ack=1 Win=65536 Len=40 TSval=2438816727 TSecr=2438815723"
"103","49.121099004","127.0.0.1","127.0.0.1","TCP","66","5000  >  59334 [ACK] Seq=1 Ack=2001 Win=65536 Len=0 TSval=2438816727 TSecr=2438816727"
"104","50.125621747","127.0.0.1","127.0.0.1","TCP","106","59334  >  5000 [PSH, ACK] Seq=2001 Ack=1 Win=65536 Len=40 TSval=2438817732 TSecr=2438816727"
"105","50.125684122","127.0.0.1","127.0.0.1","TCP","66","5000  >  59334 [ACK] Seq=1 Ack=2041 Win=65536 Len=0 TSval=2438817732 TSecr=2438817732"
"106","51.126576612","127.0.0.1","127.0.0.1","TCP","106","59334  >  5000 [PSH, ACK] Seq=2041 Ack=1 Win=65536 Len=40 TSval=2438818733 TSecr=2438817732"
"107","51.126625820","127.0.0.1","127.0.0.1","TCP","66","5000  >  59334 [ACK] Seq=1 Ack=2081 Win=65536 Len=0 TSval=2438818733 TSecr=2438818733"
"108","52.131435147","127.0.0.1","127.0.0.1","TCP","106","59334  >  5000 [PSH, ACK] Seq=2081 Ack=1 Win=65536 Len=40 TSval=2438819738 TSecr=2438818733"
"109","52.131513439","127.0.0.1","127.0.0.1","TCP","66","5000  >  59334 [ACK] Seq=1 Ack=2121 Win=65536 Len=0 TSval=2438819738 TSecr=2438819738"
"110","53.136353891","127.0.0.1","127.0.0.1","TCP","106","59334  >  5000 [PSH, ACK] Seq=2121 Ack=1 Win=65536 Len=40 TSval=2438820743 TSecr=2438819738"
"111","53.136422058","127.0.0.1","127.0.0.1","TCP","66","5000  >  59334 [ACK] Seq=1 Ack=2161 Win=65536 Len=0 TSval=2438820743 TSecr=2438820743"
"112","54.136808672","127.0.0.1","127.0.0.1","TCP","106","59334  >  5000 [PSH, ACK] Seq=2161 Ack=1 Win=65536 Len=40 TSval=2438821743 TSecr=2438820743"
"113","54.136838839","127.0.0.1","127.0.0.1","TCP","66","5000  >  59334 [ACK] Seq=1 Ack=2201 Win=65536 Len=0 TSval=2438821743 TSecr=2438821743"
"114","55.141638749","127.0.0.1","127.0.0.1","TCP","106","59334  >  5000 [PSH, ACK] Seq=2201 Ack=1 Win=65536 Len=40 TSval=2438822748 TSecr=2438821743"
"115","55.141704541","127.0.0.1","127.0.0.1","TCP","66","5000  >  59334 [ACK] Seq=1 Ack=2241 Win=65536 Len=0 TSval=2438822748 TSecr=2438822748"
"116","56.141935321","127.0.0.1","127.0.0.1","TCP","106","59334  >  5000 [PSH, ACK] Seq=2241 Ack=1 Win=65536 Len=40 TSval=2438823748 TSecr=2438822748"
"117","56.141972613","127.0.0.1","127.0.0.1","TCP","66","5000  >  59334 [ACK] Seq=1 Ack=2281 Win=65536 Len=0 TSval=2438823748 TSecr=2438823748"
"118","57.142715977","127.0.0.1","127.0.0.1","TCP","106","59334  >  5000 [PSH, ACK] Seq=2281 Ack=1 Win=65536 Len=40 TSval=2438824749 TSecr=2438823748"
"119","57.142769477","127.0.0.1","127.0.0.1","TCP","66","5000  >  59334 [ACK] Seq=1 Ack=2321 Win=65536 Len=0 TSval=2438824749 TSecr=2438824749"
"120","58.147657554","127.0.0.1","127.0.0.1","TCP","106","59334  >  5000 [PSH, ACK] Seq=2321 Ack=1 Win=65536 Len=40 TSval=2438825754 TSecr=2438824749"
"121","58.147698638","127.0.0.1","127.0.0.1","TCP","66","5000  >  59334 [ACK] Seq=1 Ack=2361 Win=65536 Len=0 TSval=2438825754 TSecr=2438825754"
"122","59.150890505","127.0.0.1","127.0.0.1","TCP","106","59334  >  5000 [PSH, ACK] Seq=2361 Ack=1 Win=65536 Len=40 TSval=2438826757 TSecr=2438825754"
"123","59.150967505","127.0.0.1","127.0.0.1","TCP","66","5000  >  59334 [ACK] Seq=1 Ack=2401 Win=65536 Len=0 TSval=2438826757 TSecr=2438826757"
"124","60.155481623","127.0.0.1","127.0.0.1","TCP","106","59334  >  5000 [PSH, ACK] Seq=2401 Ack=1 Win=65536 Len=40 TSval=2438827762 TSecr=2438826757"
"125","60.155539082","127.0.0.1","127.0.0.1","TCP","66","5000  >  59334 [ACK] Seq=1 Ack=2441 Win=65536 Len=0 TSval=2438827762 TSecr=2438827762"
"126","61.156560238","127.0.0.1","127.0.0.1","TCP","106","59334  >  5000 [PSH, ACK] Seq=2441 Ack=1 Win=65536 Len=40 TSval=2438828763 TSecr=2438827762"
"127","61.156641155","127.0.0.1","127.0.0.1","TCP","66","5000  >  59334 [ACK] Seq=1 Ack=2481 Win=65536 Len=0 TSval=2438828763 TSecr=2438828763"
"128","62.161683899","127.0.0.1","127.0.0.1","TCP","106","59334  >  5000 [PSH, ACK] Seq=2481 Ack=1 Win=65536 Len=40 TSval=2438829768 TSecr=2438828763"
"129","62.161760274","127.0.0.1","127.0.0.1","TCP","66","5000  >  59334 [ACK] Seq=1 Ack=2521 Win=65536 Len=0 TSval=2438829768 TSecr=2438829768"
"130","63.162894514","127.0.0.1","127.0.0.1","TCP","106","59334  >  5000 [PSH, ACK] Seq=2521 Ack=1 Win=65536 Len=40 TSval=2438830769 TSecr=2438829768"
"131","63.162960514","127.0.0.1","127.0.0.1","TCP","66","5000  >  59334 [ACK] Seq=1 Ack=2561 Win=65536 Len=0 TSval=2438830769 TSecr=2438830769"
"132","64.163751253","127.0.0.1","127.0.0.1","TCP","106","59334  >  5000 [PSH, ACK] Seq=2561 Ack=1 Win=65536 Len=40 TSval=2438831770 TSecr=2438830769"
"133","64.163786837","127.0.0.1","127.0.0.1","TCP","66","5000  >  59334 [ACK] Seq=1 Ack=2601 Win=65536 Len=0 TSval=2438831770 TSecr=2438831770"
"134","65.168365080","127.0.0.1","127.0.0.1","TCP","106","59334  >  5000 [PSH, ACK] Seq=2601 Ack=1 Win=65536 Len=40 TSval=2438832775 TSecr=2438831770"
"135","65.168411414","127.0.0.1","127.0.0.1","TCP","66","5000  >  59334 [ACK] Seq=1 Ack=2641 Win=65536 Len=0 TSval=2438832775 TSecr=2438832775"
"136","66.172366782","127.0.0.1","127.0.0.1","TCP","106","59334  >  5000 [PSH, ACK] Seq=2641 Ack=1 Win=65536 Len=40 TSval=2438833779 TSecr=2438832775"
"137","66.172411407","127.0.0.1","127.0.0.1","TCP","66","5000  >  59334 [ACK] Seq=1 Ack=2681 Win=65536 Len=0 TSval=2438833779 TSecr=2438833779"
"138","67.175572441","127.0.0.1","127.0.0.1","TCP","106","59334  >  5000 [PSH, ACK] Seq=2681 Ack=1 Win=65536 Len=40 TSval=2438834782 TSecr=2438833779"
"139","67.175657899","127.0.0.1","127.0.0.1","TCP","66","5000  >  59334 [ACK] Seq=1 Ack=2721 Win=65536 Len=0 TSval=2438834782 TSecr=2438834782"
"140","68.180501393","127.0.0.1","127.0.0.1","TCP","106","59334  >  5000 [PSH, ACK] Seq=2721 Ack=1 Win=65536 Len=40 TSval=2438835787 TSecr=2438834782"
"141","68.180578185","127.0.0.1","127.0.0.1","TCP","66","5000  >  59334 [ACK] Seq=1 Ack=2761 Win=65536 Len=0 TSval=2438835787 TSecr=2438835787"
"142","69.183052051","127.0.0.1","127.0.0.1","TCP","106","59334  >  5000 [PSH, ACK] Seq=2761 Ack=1 Win=65536 Len=40 TSval=2438836789 TSecr=2438835787"
"143","69.183110260","127.0.0.1","127.0.0.1","TCP","66","5000  >  59334 [ACK] Seq=1 Ack=2801 Win=65536 Len=0 TSval=2438836789 TSecr=2438836789"
"144","70.185571251","127.0.0.1","127.0.0.1","TCP","106","59334  >  5000 [PSH, ACK] Seq=2801 Ack=1 Win=65536 Len=40 TSval=2438837792 TSecr=2438836789"
"145","70.185653584","127.0.0.1","127.0.0.1","TCP","66","5000  >  59334 [ACK] Seq=1 Ack=2841 Win=65536 Len=0 TSval=2438837792 TSecr=2438837792"
"146","71.190085995","127.0.0.1","127.0.0.1","TCP","106","59334  >  5000 [PSH, ACK] Seq=2841 Ack=1 Win=65536 Len=40 TSval=2438838796 TSecr=2438837792"
"147","71.190164203","127.0.0.1","127.0.0.1","TCP","66","5000  >  59334 [ACK] Seq=1 Ack=2881 Win=65536 Len=0 TSval=2438838796 TSecr=2438838796"
"148","72.192879403","127.0.0.1","127.0.0.1","TCP","106","59334  >  5000 [PSH, ACK] Seq=2881 Ack=1 Win=65536 Len=40 TSval=2438839799 TSecr=2438838796"
"149","72.192947486","127.0.0.1","127.0.0.1","TCP","66","5000  >  59334 [ACK] Seq=1 Ack=2921 Win=65536 Len=0 TSval=2438839799 TSecr=2438839799"
"150","73.195343186","127.0.0.1","127.0.0.1","TCP","106","59334  >  5000 [PSH, ACK] Seq=2921 Ack=1 Win=65536 Len=40 TSval=2438840801 TSecr=2438839799"
"151","73.195393228","127.0.0.1","127.0.0.1","TCP","66","5000  >  59334 [ACK] Seq=1 Ack=2961 Win=65536 Len=0 TSval=2438840802 TSecr=2438840801"
"152","74.196172342","127.0.0.1","127.0.0.1","TCP","106","59334  >  5000 [PSH, ACK] Seq=2961 Ack=1 Win=65536 Len=40 TSval=2438841802 TSecr=2438840802"
"153","74.196231467","127.0.0.1","127.0.0.1","TCP","66","5000  >  59334 [ACK] Seq=1 Ack=3001 Win=65536 Len=0 TSval=2438841802 TSecr=2438841802"
"154","75.196501123","127.0.0.1","127.0.0.1","TCP","106","59334  >  5000 [PSH, ACK] Seq=3001 Ack=1 Win=65536 Len=40 TSval=2438842803 TSecr=2438841802"
"155","75.196560415","127.0.0.1","127.0.0.1","TCP","66","5000  >  59334 [ACK] Seq=1 Ack=3041 Win=65536 Len=0 TSval=2438842803 TSecr=2438842803"
"156","76.196782028","127.0.0.1","127.0.0.1","TCP","106","59334  >  5000 [PSH, ACK] Seq=3041 Ack=1 Win=65536 Len=40 TSval=2438843803 TSecr=2438842803"
"157","76.196820362","127.0.0.1","127.0.0.1","TCP","66","5000  >  59334 [ACK] Seq=1 Ack=3081 Win=65536 Len=0 TSval=2438843803 TSecr=2438843803"
"158","77.197020517","127.0.0.1","127.0.0.1","TCP","106","59334  >  5000 [PSH, ACK] Seq=3081 Ack=1 Win=65536 Len=40 TSval=2438844803 TSecr=2438843803"
"159","77.197057309","127.0.0.1","127.0.0.1","TCP","66","5000  >  59334 [ACK] Seq=1 Ack=3121 Win=65536 Len=0 TSval=2438844803 TSecr=2438844803"
"160","78.197225798","127.0.0.1","127.0.0.1","TCP","106","59334  >  5000 [PSH, ACK] Seq=3121 Ack=1 Win=65536 Len=40 TSval=2438845803 TSecr=2438844803"
"161","78.197258965","127.0.0.1","127.0.0.1","TCP","66","5000  >  59334 [ACK] Seq=1 Ack=3161 Win=65536 Len=0 TSval=2438845803 TSecr=2438845803"
"162","79.197486828","127.0.0.1","127.0.0.1","TCP","106","59334  >  5000 [PSH, ACK] Seq=3161 Ack=1 Win=65536 Len=40 TSval=2438846804 TSecr=2438845803"
"163","79.197535953","127.0.0.1","127.0.0.1","TCP","66","5000  >  59334 [ACK] Seq=1 Ack=3201 Win=65536 Len=0 TSval=2438846804 TSecr=2438846804"
"164","80.197731151","127.0.0.1","127.0.0.1","TCP","106","59334  >  5000 [PSH, ACK] Seq=3201 Ack=1 Win=65536 Len=40 TSval=2438847804 TSecr=2438846804"
"165","80.197760817","127.0.0.1","127.0.0.1","TCP","66","5000  >  59334 [ACK] Seq=1 Ack=3241 Win=65536 Len=0 TSval=2438847804 TSecr=2438847804"
"166","81.197933181","127.0.0.1","127.0.0.1","TCP","106","59334  >  5000 [PSH, ACK] Seq=3241 Ack=1 Win=65536 Len=40 TSval=2438848804 TSecr=2438847804"
"167","81.197962431","127.0.0.1","127.0.0.1","TCP","66","5000  >  59334 [ACK] Seq=1 Ack=3281 Win=65536 Len=0 TSval=2438848804 TSecr=2438848804"
"168","82.198131170","127.0.0.1","127.0.0.1","TCP","106","59334  >  5000 [PSH, ACK] Seq=3281 Ack=1 Win=65536 Len=40 TSval=2438849804 TSecr=2438848804"
"169","82.198158128","127.0.0.1","127.0.0.1","TCP","66","5000  >  59334 [ACK] Seq=1 Ack=3321 Win=65536 Len=0 TSval=2438849804 TSecr=2438849804"
"170","83.199022535","127.0.0.1","127.0.0.1","TCP","106","59334  >  5000 [PSH, ACK] Seq=3321 Ack=1 Win=65536 Len=40 TSval=2438850805 TSecr=2438849804"
"171","83.199064368","127.0.0.1","127.0.0.1","TCP","66","5000  >  59334 [ACK] Seq=1 Ack=3361 Win=65536 Len=0 TSval=2438850805 TSecr=2438850805"
"172","84.199522274","127.0.0.1","127.0.0.1","TCP","106","59334  >  5000 [PSH, ACK] Seq=3361 Ack=1 Win=65536 Len=40 TSval=2438851806 TSecr=2438850805"
"173","84.199568607","127.0.0.1","127.0.0.1","TCP","66","5000  >  59334 [ACK] Seq=1 Ack=3401 Win=65536 Len=0 TSval=2438851806 TSecr=2438851806"
"174","85.200238597","127.0.0.1","127.0.0.1","TCP","106","59334  >  5000 [PSH, ACK] Seq=3401 Ack=1 Win=65536 Len=40 TSval=2438852806 TSecr=2438851806"
"175","85.200278347","127.0.0.1","127.0.0.1","TCP","66","5000  >  59334 [ACK] Seq=1 Ack=3441 Win=65536 Len=0 TSval=2438852807 TSecr=2438852806"
"176","86.200413586","127.0.0.1","127.0.0.1","TCP","106","59334  >  5000 [PSH, ACK] Seq=3441 Ack=1 Win=65536 Len=40 TSval=2438853807 TSecr=2438852807"
"177","86.200428128","127.0.0.1","127.0.0.1","TCP","66","5000  >  59334 [ACK] Seq=1 Ack=3481 Win=65536 Len=0 TSval=2438853807 TSecr=2438853807"
"178","87.200574158","127.0.0.1","127.0.0.1","TCP","106","59334  >  5000 [PSH, ACK] Seq=3481 Ack=1 Win=65536 Len=40 TSval=2438854807 TSecr=2438853807"
"179","87.200603658","127.0.0.1","127.0.0.1","TCP","66","5000  >  59334 [ACK] Seq=1 Ack=3521 Win=65536 Len=0 TSval=2438854807 TSecr=2438854807"
"180","88.200757355","127.0.0.1","127.0.0.1","TCP","106","59334  >  5000 [PSH, ACK] Seq=3521 Ack=1 Win=65536 Len=40 TSval=2438855807 TSecr=2438854807"
"181","88.200781355","127.0.0.1","127.0.0.1","TCP","66","5000  >  59334 [ACK] Seq=1 Ack=3561 Win=65536 Len=0 TSval=2438855807 TSecr=2438855807"
"182","89.200978553","127.0.0.1","127.0.0.1","TCP","106","59334  >  5000 [PSH, ACK] Seq=3561 Ack=1 Win=65536 Len=40 TSval=2438856807 TSecr=2438855807"
"183","89.201000803","127.0.0.1","127.0.0.1","TCP","66","5000  >  59334 [ACK] Seq=1 Ack=3601 Win=65536 Len=0 TSval=2438856807 TSecr=2438856807"
"184","90.201750542","127.0.0.1","127.0.0.1","TCP","106","59334  >  5000 [PSH, ACK] Seq=3601 Ack=1 Win=65536 Len=40 TSval=2438857808 TSecr=2438856807"
"185","90.201776417","127.0.0.1","127.0.0.1","TCP","66","5000  >  59334 [ACK] Seq=1 Ack=3641 Win=65536 Len=0 TSval=2438857808 TSecr=2438857808"
"186","91.202641491","127.0.0.1","127.0.0.1","TCP","106","59334  >  5000 [PSH, ACK] Seq=3641 Ack=1 Win=65536 Len=40 TSval=2438858809 TSecr=2438857808"
"187","91.202673282","127.0.0.1","127.0.0.1","TCP","66","5000  >  59334 [ACK] Seq=1 Ack=3681 Win=65536 Len=0 TSval=2438858809 TSecr=2438858809"
"188","92.202878271","127.0.0.1","127.0.0.1","TCP","106","59334  >  5000 [PSH, ACK] Seq=3681 Ack=1 Win=65536 Len=40 TSval=2438859809 TSecr=2438858809"
"189","92.202907521","127.0.0.1","127.0.0.1","TCP","66","5000  >  59334 [ACK] Seq=1 Ack=3721 Win=65536 Len=0 TSval=2438859809 TSecr=2438859809"
"190","93.203158177","127.0.0.1","127.0.0.1","TCP","106","59334  >  5000 [PSH, ACK] Seq=3721 Ack=1 Win=65536 Len=40 TSval=2438860809 TSecr=2438859809"
"191","93.203210844","127.0.0.1","127.0.0.1","TCP","66","5000  >  59334 [ACK] Seq=1 Ack=3761 Win=65536 Len=0 TSval=2438860809 TSecr=2438860809"
"192","94.203787708","127.0.0.1","127.0.0.1","TCP","106","59334  >  5000 [PSH, ACK] Seq=3761 Ack=1 Win=65536 Len=40 TSval=2438861810 TSecr=2438860809"
"193","94.203852333","127.0.0.1","127.0.0.1","TCP","66","5000  >  59334 [ACK] Seq=1 Ack=3801 Win=65536 Len=0 TSval=2438861810 TSecr=2438861810"
"194","95.204852115","127.0.0.1","127.0.0.1","TCP","106","59334  >  5000 [PSH, ACK] Seq=3801 Ack=1 Win=65536 Len=40 TSval=2438862811 TSecr=2438861810"
"195","95.204960615","127.0.0.1","127.0.0.1","TCP","66","5000  >  59334 [ACK] Seq=1 Ack=3841 Win=65536 Len=0 TSval=2438862811 TSecr=2438862811"
"196","96.205573813","127.0.0.1","127.0.0.1","TCP","106","59334  >  5000 [PSH, ACK] Seq=3841 Ack=1 Win=65536 Len=40 TSval=2438863812 TSecr=2438862811"
"197","96.205666688","127.0.0.1","127.0.0.1","TCP","66","5000  >  59334 [ACK] Seq=1 Ack=3881 Win=65536 Len=0 TSval=2438863812 TSecr=2438863812"
"198","97.206825887","127.0.0.1","127.0.0.1","TCP","106","59334  >  5000 [PSH, ACK] Seq=3881 Ack=1 Win=65536 Len=40 TSval=2438864813 TSecr=2438863812"
"199","97.206920803","127.0.0.1","127.0.0.1","TCP","66","5000  >  59334 [ACK] Seq=1 Ack=3921 Win=65536 Len=0 TSval=2438864813 TSecr=2438864813"
"200","98.207194459","127.0.0.1","127.0.0.1","TCP","106","59334  >  5000 [PSH, ACK] Seq=3921 Ack=1 Win=65536 Len=40 TSval=2438865813 TSecr=2438864813"
"201","98.207464960","127.0.0.1","127.0.0.1","TCP","66","5000  >  59334 [ACK] Seq=1 Ack=3961 Win=65536 Len=0 TSval=2438865813 TSecr=2438865813"
"202","99.208484700","127.0.0.1","127.0.0.1","TCP","106","59334  >  5000 [PSH, ACK] Seq=3961 Ack=1 Win=65536 Len=40 TSval=2438866815 TSecr=2438865813"
"203","99.208570116","127.0.0.1","127.0.0.1","TCP","66","5000  >  59334 [ACK] Seq=1 Ack=4001 Win=65536 Len=0 TSval=2438866815 TSecr=2438866815"
"204","100.208900772","127.0.0.1","127.0.0.1","TCP","106","59334  >  5000 [PSH, ACK] Seq=4001 Ack=1 Win=65536 Len=40 TSval=2438867815 TSecr=2438866815"
"205","100.208987147","127.0.0.1","127.0.0.1","TCP","66","5000  >  59334 [ACK] Seq=1 Ack=4041 Win=65536 Len=0 TSval=2438867815 TSecr=2438867815"
"206","101.210045179","127.0.0.1","127.0.0.1","TCP","75","59334  >  5000 [PSH, ACK] Seq=4041 Ack=1 Win=65536 Len=9 TSval=2438868816 TSecr=2438867815"
"207","101.210142721","127.0.0.1","127.0.0.1","TCP","66","5000  >  59334 [ACK] Seq=1 Ack=4050 Win=65536 Len=0 TSval=2438868816 TSecr=2438868816"
"208","102.211120503","127.0.0.1","127.0.0.1","TCP","66","59334  >  5000 [FIN, ACK] Seq=4050 Ack=1 Win=65536 Len=0 TSval=2438869817 TSecr=2438868816"
"209","102.211595378","127.0.0.1","127.0.0.1","TCP","66","5000  >  59334 [FIN, ACK] Seq=1 Ack=4051 Win=65536 Len=0 TSval=2438869818 TSecr=2438869817"
"210","102.211700753","127.0.0.1","127.0.0.1","TCP","66","59334  >  5000 [ACK] Seq=4051 Ack=2 Win=65536 Len=0 TSval=2438869818 TSecr=2438869818"
