"No.","Time","Source","Destination","Protocol","Length","Info"
"1","0.000000000","192.168.64.3","192.168.64.2","TCP","76","59102  >  5000 [SYN] Seq=0 Win=64240 Len=0 MSS=1460 SACK_PERM TSval=3858789598 TSecr=0 WS=128"
"2","0.000043917","192.168.64.2","192.168.64.3","TCP","76","5000  >  59102 [SYN, ACK] Seq=0 Ack=1 Win=65160 Len=0 MSS=1460 SACK_PERM TSval=2016607471 TSecr=3858789598 WS=128"
"3","0.000522460","192.168.64.3","192.168.64.2","TCP","68","59102  >  5000 [ACK] Seq=1 Ack=1 Win=64256 Len=0 TSval=3858789598 TSecr=2016607471"
"4","0.000808419","192.168.64.3","192.168.64.2","TCP","108","59102  >  5000 [PSH, ACK] Seq=1 Ack=1 Win=64256 Len=40 TSval=3858789598 TSecr=2016607471"
"5","0.000833878","192.168.64.2","192.168.64.3","TCP","68","5000  >  59102 [ACK] Seq=1 Ack=41 Win=65152 Len=0 TSval=2016607472 TSecr=3858789598"
"6","1.004075565","192.168.64.3","192.168.64.2","TCP","108","59102  >  5000 [PSH, ACK] Seq=41 Ack=1 Win=64256 Len=40 TSval=3858790601 TSecr=2016607472"
"7","1.004268690","192.168.64.2","192.168.64.3","TCP","68","5000  >  59102 [ACK] Seq=1 Ack=81 Win=65152 Len=0 TSval=2016608476 TSecr=3858790601"
"8","2.005593371","192.168.64.3","192.168.64.2","TCP","108","59102  >  5000 [PSH, ACK] Seq=81 Ack=1 Win=64256 Len=40 TSval=3858791602 TSecr=2016608476"
"9","2.005710621","192.168.64.2","192.168.64.3","TCP","68","5000  >  59102 [ACK] Seq=1 Ack=121 Win=65152 Len=0 TSval=2016609477 TSecr=3858791602"
"10","3.006729133","192.168.64.3","192.168.64.2","TCP","108","59102  >  5000 [PSH, ACK] Seq=121 Ack=1 Win=64256 Len=40 TSval=3858792604 TSecr=2016609477"
"11","3.006813758","192.168.64.2","192.168.64.3","TCP","68","5000  >  59102 [ACK] Seq=1 Ack=161 Win=65152 Len=0 TSval=2016610478 TSecr=3858792604"
"12","4.008784897","192.168.64.3","192.168.64.2","TCP","108","59102  >  5000 [PSH, ACK] Seq=161 Ack=1 Win=64256 Len=40 TSval=3858793605 TSecr=2016610478"
"13","4.008865523","192.168.64.2","192.168.64.3","TCP","68","5000  >  59102 [ACK] Seq=1 Ack=201 Win=65152 Len=0 TSval=2016611480 TSecr=3858793605"
"14","5.011720996","192.168.64.3","192.168.64.2","TCP","108","59102  >  5000 [PSH, ACK] Seq=201 Ack=1 Win=64256 Len=40 TSval=3858794609 TSecr=2016611480"
"15","5.011812622","192.168.64.2","192.168.64.3","TCP","68","5000  >  59102 [ACK] Seq=1 Ack=241 Win=65152 Len=0 TSval=2016612483 TSecr=3858794609"
"16","6.014912637","192.168.64.3","192.168.64.2","TCP","108","59102  >  5000 [PSH, ACK] Seq=241 Ack=1 Win=64256 Len=40 TSval=3858795612 TSecr=2016612483"
"17","6.014976054","192.168.64.2","192.168.64.3","TCP","68","5000  >  59102 [ACK] Seq=1 Ack=281 Win=65152 Len=0 TSval=2016613486 TSecr=3858795612"
"18","7.016754773","192.168.64.3","192.168.64.2","TCP","108","59102  >  5000 [PSH, ACK] Seq=281 Ack=1 Win=64256 Len=40 TSval=3858796613 TSecr=2016613486"
"19","7.016851357","192.168.64.2","192.168.64.3","TCP","68","5000  >  59102 [ACK] Seq=1 Ack=321 Win=65152 Len=0 TSval=2016614488 TSecr=3858796613"
"20","8.019841995","192.168.64.3","192.168.64.2","TCP","108","59102  >  5000 [PSH, ACK] Seq=321 Ack=1 Win=64256 Len=40 TSval=3858797616 TSecr=2016614488"
"21","8.019933704","192.168.64.2","192.168.64.3","TCP","68","5000  >  59102 [ACK] Seq=1 Ack=361 Win=65152 Len=0 TSval=2016615491 TSecr=3858797616"
"22","9.022615382","192.168.64.3","192.168.64.2","TCP","108","59102  >  5000 [PSH, ACK] Seq=361 Ack=1 Win=64256 Len=40 TSval=3858798619 TSecr=2016615491"
"23","9.022721966","192.168.64.2","192.168.64.3","TCP","68","5000  >  59102 [ACK] Seq=1 Ack=401 Win=65152 Len=0 TSval=2016616494 TSecr=3858798619"
"24","10.024202515","192.168.64.3","192.168.64.2","TCP","108","59102  >  5000 [PSH, ACK] Seq=401 Ack=1 Win=64256 Len=40 TSval=3858799620 TSecr=2016616494"
"25","10.024285515","192.168.64.2","192.168.64.3","TCP","68","5000  >  59102 [ACK] Seq=1 Ack=441 Win=65152 Len=0 TSval=2016617496 TSecr=3858799620"
"26","11.025539646","192.168.64.3","192.168.64.2","TCP","108","59102  >  5000 [PSH, ACK] Seq=441 Ack=1 Win=64256 Len=40 TSval=3858800622 TSecr=2016617496"
"27","11.025647063","192.168.64.2","192.168.64.3","TCP","68","5000  >  59102 [ACK] Seq=1 Ack=481 Win=65152 Len=0 TSval=2016618497 TSecr=3858800622"
"28","12.031591540","192.168.64.3","192.168.64.2","TCP","108","59102  >  5000 [PSH, ACK] Seq=481 Ack=1 Win=64256 Len=40 TSval=3858801625 TSecr=2016618497"
"29","12.031666915","192.168.64.2","192.168.64.3","TCP","68","5000  >  59102 [ACK] Seq=1 Ack=521 Win=65152 Len=0 TSval=2016619503 TSecr=3858801625"
"30","13.036825430","192.168.64.3","192.168.64.2","TCP","108","59102  >  5000 [PSH, ACK] Seq=521 Ack=1 Win=64256 Len=40 TSval=3858802633 TSecr=2016619503"
"31","13.036913764","192.168.64.2","192.168.64.3","TCP","68","5000  >  59102 [ACK] Seq=1 Ack=561 Win=65152 Len=0 TSval=2016620508 TSecr=3858802633"
"32","14.041642235","192.168.64.3","192.168.64.2","TCP","108","59102  >  5000 [PSH, ACK] Seq=561 Ack=1 Win=64256 Len=40 TSval=3858803638 TSecr=2016620508"
"33","14.041736694","192.168.64.2","192.168.64.3","TCP","68","5000  >  59102 [ACK] Seq=1 Ack=601 Win=65152 Len=0 TSval=2016621513 TSecr=3858803638"
"34","15.043553782","192.168.64.3","192.168.64.2","TCP","108","59102  >  5000 [PSH, ACK] Seq=601 Ack=1 Win=64256 Len=40 TSval=3858804639 TSecr=2016621513"
"35","15.043658365","192.168.64.2","192.168.64.3","TCP","68","5000  >  59102 [ACK] Seq=1 Ack=641 Win=65152 Len=0 TSval=2016622515 TSecr=3858804639"
"36","16.044870409","192.168.64.3","192.168.64.2","TCP","108","59102  >  5000 [PSH, ACK] Seq=641 Ack=1 Win=64256 Len=40 TSval=3858805641 TSecr=2016622515"
"37","16.044953617","192.168.64.2","192.168.64.3","TCP","68","5000  >  59102 [ACK] Seq=1 Ack=681 Win=65152 Len=0 TSval=2016623516 TSecr=3858805641"
"38","17.046668120","192.168.64.3","192.168.64.2","TCP","108","59102  >  5000 [PSH, ACK] Seq=681 Ack=1 Win=64256 Len=40 TSval=3858806642 TSecr=2016623516"
"39","17.046770328","192.168.64.2","192.168.64.3","TCP","68","5000  >  59102 [ACK] Seq=1 Ack=721 Win=65152 Len=0 TSval=2016624518 TSecr=3858806642"
"40","18.047867120","192.168.64.3","192.168.64.2","TCP","108","59102  >  5000 [PSH, ACK] Seq=721 Ack=1 Win=64256 Len=40 TSval=3858807644 TSecr=2016624518"
"41","18.047905745","192.168.64.2","192.168.64.3","TCP","68","5000  >  59102 [ACK] Seq=1 Ack=761 Win=65152 Len=0 TSval=2016625519 TSecr=3858807644"
"42","19.053026755","192.168.64.3","192.168.64.2","TCP","108","59102  >  5000 [PSH, ACK] Seq=761 Ack=1 Win=64256 Len=40 TSval=3858808648 TSecr=2016625519"
"43","19.053131464","192.168.64.2","192.168.64.3","TCP","68","5000  >  59102 [ACK] Seq=1 Ack=801 Win=65152 Len=0 TSval=2016626524 TSecr=3858808648"
"44","20.056742636","192.168.64.3","192.168.64.2","TCP","108","59102  >  5000 [PSH, ACK] Seq=801 Ack=1 Win=64256 Len=40 TSval=3858809652 TSecr=2016626524"
"45","20.056833886","192.168.64.2","192.168.64.3","TCP","68","5000  >  59102 [ACK] Seq=1 Ack=841 Win=65152 Len=0 TSval=2016627528 TSecr=3858809652"
"46","21.058198343","192.168.64.3","192.168.64.2","TCP","108","59102  >  5000 [PSH, ACK] Seq=841 Ack=1 Win=64256 Len=40 TSval=3858810654 TSecr=2016627528"
"47","21.058302801","192.168.64.2","192.168.64.3","TCP","68","5000  >  59102 [ACK] Seq=1 Ack=881 Win=65152 Len=0 TSval=2016628530 TSecr=3858810654"
"48","22.059445256","192.168.64.3","192.168.64.2","TCP","108","59102  >  5000 [PSH, ACK] Seq=881 Ack=1 Win=64256 Len=40 TSval=3858811655 TSecr=2016628530"
"49","22.059528173","192.168.64.2","192.168.64.3","TCP","68","5000  >  59102 [ACK] Seq=1 Ack=921 Win=65152 Len=0 TSval=2016629531 TSecr=3858811655"
"50","23.064728055","192.168.64.3","192.168.64.2","TCP","108","59102  >  5000 [PSH, ACK] Seq=921 Ack=1 Win=64256 Len=40 TSval=3858812660 TSecr=2016629531"
"51","23.064844306","192.168.64.2","192.168.64.3","TCP","68","5000  >  59102 [ACK] Seq=1 Ack=961 Win=65152 Len=0 TSval=2016630536 TSecr=3858812660"
"52","24.069042643","192.168.64.3","192.168.64.2","TCP","108","59102  >  5000 [PSH, ACK] Seq=961 Ack=1 Win=64256 Len=40 TSval=3858813664 TSecr=2016630536"
"53","24.069148226","192.168.64.2","192.168.64.3","TCP","68","5000  >  59102 [ACK] Seq=1 Ack=1001 Win=65152 Len=0 TSval=2016631540 TSecr=3858813664"
"54","25.070784430","192.168.64.3","192.168.64.2","TCP","108","59102  >  5000 [PSH, ACK] Seq=1001 Ack=1 Win=64256 Len=40 TSval=3858814666 TSecr=2016631540"
"55","25.070861972","192.168.64.2","192.168.64.3","TCP","68","5000  >  59102 [ACK] Seq=1 Ack=1041 Win=65152 Len=0 TSval=2016632542 TSecr=3858814666"
"56","26.075402850","192.168.64.3","192.168.64.2","TCP","108","59102  >  5000 [PSH, ACK] Seq=1041 Ack=1 Win=64256 Len=40 TSval=3858815670 TSecr=2016632542"
"57","26.075498976","192.168.64.2","192.168.64.3","TCP","68","5000  >  59102 [ACK] Seq=1 Ack=1081 Win=65152 Len=0 TSval=2016633547 TSecr=3858815670"
"58","1829.992814775","192.168.64.3","192.168.64.2","TCP","108","59102  >  5000 [PSH, ACK] Seq=1081 Ack=1 Win=64256 Len=40 TSval=3858816676 TSecr=2016633547"
"59","1829.992930692","192.168.64.2","192.168.64.3","TCP","68","5000  >  59102 [ACK] Seq=1 Ack=1121 Win=65152 Len=0 TSval=2016634552 TSecr=3858816676"
"60","1829.993310610","192.168.64.2","192.168.64.3","TCP","68","5000  >  59102 [FIN, ACK] Seq=1 Ack=1121 Win=65152 Len=0 TSval=2016634553 TSecr=3858816676"
"61","1829.995465532","192.168.64.3","192.168.64.2","TCP","68","59102  >  5000 [ACK] Seq=1121 Ack=2 Win=64256 Len=0 TSval=3858816679 TSecr=2016634553"
"62","1830.993849110","192.168.64.3","192.168.64.2","TCP","108","59102  >  5000 [PSH, ACK] Seq=1121 Ack=2 Win=64256 Len=40 TSval=3858817677 TSecr=2016634553"
"63","1830.993935902","192.168.64.2","192.168.64.3","TCP","56","5000  >  59102 [RST] Seq=2 Win=0 Len=0"
