"No.","Time","Source","Destination","Protocol","Length","Info"
"1","0.000000000","192.168.64.3","192.168.64.2","TCP","76","49908  >  5000 [SYN] Seq=0 Win=64240 Len=0 MSS=1460 SACK_PERM TSval=3857190712 TSecr=0 WS=128"
"2","0.000135709","192.168.64.2","192.168.64.3","TCP","76","5000  >  49908 [SYN, ACK] Seq=0 Ack=1 Win=65160 Len=0 MSS=1460 SACK_PERM TSval=2015008452 TSecr=3857190712 WS=128"
"3","0.000682837","192.168.64.3","192.168.64.2","TCP","68","49908  >  5000 [ACK] Seq=1 Ack=1 Win=64256 Len=0 TSval=3857190713 TSecr=2015008452"
"4","0.001814551","192.168.64.3","192.168.64.2","TCP","108","49908  >  5000 [PSH, ACK] Seq=1 Ack=1 Win=64256 Len=40 TSval=3857190714 TSecr=2015008452"
"5","0.001824009","192.168.64.2","192.168.64.3","TCP","68","5000  >  49908 [ACK] Seq=1 Ack=41 Win=65152 Len=0 TSval=2015008453 TSecr=3857190714"
"6","1.004735504","192.168.64.3","192.168.64.2","TCP","108","49908  >  5000 [PSH, ACK] Seq=41 Ack=1 Win=64256 Len=40 TSval=3857191717 TSecr=2015008453"
"7","1.004969839","192.168.64.2","192.168.64.3","TCP","68","5000  >  49908 [ACK] Seq=1 Ack=81 Win=65152 Len=0 TSval=2015009457 TSecr=3857191717"
"8","2.010235723","192.168.64.3","192.168.64.2","TCP","108","49908  >  5000 [PSH, ACK] Seq=81 Ack=1 Win=64256 Len=40 TSval=3857192722 TSecr=2015009457"
"9","2.010371265","192.168.64.2","192.168.64.3","TCP","68","5000  >  49908 [ACK] Seq=1 Ack=121 Win=65152 Len=0 TSval=2015010462 TSecr=3857192722"
"10","3.010659419","192.168.64.3","192.168.64.2","TCP","108","49908  >  5000 [PSH, ACK] Seq=121 Ack=1 Win=64256 Len=40 TSval=3857193722 TSecr=2015010462"
"11","3.010772628","192.168.64.2","192.168.64.3","TCP","68","5000  >  49908 [ACK] Seq=1 Ack=161 Win=65152 Len=0 TSval=2015011462 TSecr=3857193722"
"12","4.014722136","192.168.64.3","192.168.64.2","TCP","108","49908  >  5000 [PSH, ACK] Seq=161 Ack=1 Win=64256 Len=40 TSval=3857194726 TSecr=2015011462"
"13","4.014844637","192.168.64.2","192.168.64.3","TCP","68","5000  >  49908 [ACK] Seq=1 Ack=201 Win=65152 Len=0 TSval=2015012466 TSecr=3857194726"
"14","5.017264390","192.168.64.3","192.168.64.2","TCP","108","49908  >  5000 [PSH, ACK] Seq=201 Ack=1 Win=64256 Len=40 TSval=3857195729 TSecr=2015012466"
"15","5.017327974","192.168.64.2","192.168.64.3","TCP","68","5000  >  49908 [ACK] Seq=1 Ack=241 Win=65152 Len=0 TSval=2015013469 TSecr=3857195729"
"16","6.025110507","192.168.64.3","192.168.64.2","TCP","108","49908  >  5000 [PSH, ACK] Seq=241 Ack=1 Win=64256 Len=40 TSval=3857196737 TSecr=2015013469"
"17","6.025201091","192.168.64.2","192.168.64.3","TCP","68","5000  >  49908 [ACK] Seq=1 Ack=281 Win=65152 Len=0 TSval=2015014477 TSecr=3857196737"
"18","7.027259056","192.168.64.3","192.168.64.2","TCP","108","49908  >  5000 [PSH, ACK] Seq=281 Ack=1 Win=64256 Len=40 TSval=3857197739 TSecr=2015014477"
"19","7.027379973","192.168.64.2","192.168.64.3","TCP","68","5000  >  49908 [ACK] Seq=1 Ack=321 Win=65152 Len=0 TSval=2015015479 TSecr=3857197739"
"20","8.028331977","192.168.64.3","192.168.64.2","TCP","108","49908  >  5000 [PSH, ACK] Seq=321 Ack=1 Win=64256 Len=40 TSval=3857198740 TSecr=2015015479"
"21","8.028386061","192.168.64.2","192.168.64.3","TCP","68","5000  >  49908 [ACK] Seq=1 Ack=361 Win=65152 Len=0 TSval=2015016480 TSecr=3857198740"
"22","9.031913872","192.168.64.3","192.168.64.2","TCP","108","49908  >  5000 [PSH, ACK] Seq=361 Ack=1 Win=64256 Len=40 TSval=3857199744 TSecr=2015016480"
"23","9.031945455","192.168.64.2","192.168.64.3","TCP","68","5000  >  49908 [ACK] Seq=1 Ack=401 Win=65152 Len=0 TSval=2015017484 TSecr=3857199744"
"24","10.035865521","192.168.64.3","192.168.64.2","TCP","108","49908  >  5000 [PSH, ACK] Seq=401 Ack=1 Win=64256 Len=40 TSval=3857200748 TSecr=2015017484"
"25","10.035903562","192.168.64.2","192.168.64.3","TCP","68","5000  >  49908 [ACK] Seq=1 Ack=441 Win=65152 Len=0 TSval=2015018488 TSecr=3857200748"
"26","11.038490582","192.168.64.3","192.168.64.2","TCP","108","49908  >  5000 [PSH, ACK] Seq=441 Ack=1 Win=64256 Len=40 TSval=3857201750 TSecr=2015018488"
"27","11.038526915","192.168.64.2","192.168.64.3","TCP","68","5000  >  49908 [ACK] Seq=1 Ack=481 Win=65152 Len=0 TSval=2015019490 TSecr=3857201750"
"28","12.044158453","192.168.64.3","192.168.64.2","TCP","108","49908  >  5000 [PSH, ACK] Seq=481 Ack=1 Win=64256 Len=40 TSval=3857202755 TSecr=2015019490"
"29","12.044286787","192.168.64.2","192.168.64.3","TCP","68","5000  >  49908 [ACK] Seq=1 Ack=521 Win=65152 Len=0 TSval=2015020496 TSecr=3857202755"
"30","13.048453527","192.168.64.3","192.168.64.2","TCP","108","49908  >  5000 [PSH, ACK] Seq=521 Ack=1 Win=64256 Len=40 TSval=3857203759 TSecr=2015020496"
"31","13.048577695","192.168.64.2","192.168.64.3","TCP","68","5000  >  49908 [ACK] Seq=1 Ack=561 Win=65152 Len=0 TSval=2015021500 TSecr=3857203759"
"32","14.052607854","192.168.64.3","192.168.64.2","TCP","108","49908  >  5000 [PSH, ACK] Seq=561 Ack=1 Win=64256 Len=40 TSval=3857204764 TSecr=2015021500"
"33","14.052671354","192.168.64.2","192.168.64.3","TCP","68","5000  >  49908 [ACK] Seq=1 Ack=601 Win=65152 Len=0 TSval=2015022504 TSecr=3857204764"
"34","15.055957095","192.168.64.3","192.168.64.2","TCP","108","49908  >  5000 [PSH, ACK] Seq=601 Ack=1 Win=64256 Len=40 TSval=3857205767 TSecr=2015022504"
"35","15.056055053","192.168.64.2","192.168.64.3","TCP","68","5000  >  49908 [ACK] Seq=1 Ack=641 Win=65152 Len=0 TSval=2015023508 TSecr=3857205767"
"36","16.057524412","192.168.64.3","192.168.64.2","TCP","108","49908  >  5000 [PSH, ACK] Seq=641 Ack=1 Win=64256 Len=40 TSval=3857206768 TSecr=2015023508"
"37","16.057617871","192.168.64.2","192.168.64.3","TCP","68","5000  >  49908 [ACK] Seq=1 Ack=681 Win=65152 Len=0 TSval=2015024509 TSecr=3857206768"
"38","17.060336072","192.168.64.3","192.168.64.2","TCP","108","49908  >  5000 [PSH, ACK] Seq=681 Ack=1 Win=64256 Len=40 TSval=3857207771 TSecr=2015024509"
"39","17.060464989","192.168.64.2","192.168.64.3","TCP","68","5000  >  49908 [ACK] Seq=1 Ack=721 Win=65152 Len=0 TSval=2015025512 TSecr=3857207771"
"40","18.061814268","192.168.64.3","192.168.64.2","TCP","108","49908  >  5000 [PSH, ACK] Seq=721 Ack=1 Win=64256 Len=40 TSval=3857208773 TSecr=2015025512"
"41","18.061869477","192.168.64.2","192.168.64.3","TCP","68","5000  >  49908 [ACK] Seq=1 Ack=761 Win=65152 Len=0 TSval=2015026514 TSecr=3857208773"
"42","19.067223070","192.168.64.3","192.168.64.2","TCP","108","49908  >  5000 [PSH, ACK] Seq=761 Ack=1 Win=64256 Len=40 TSval=3857209778 TSecr=2015026514"
"43","19.067320446","192.168.64.2","192.168.64.3","TCP","68","5000  >  49908 [ACK] Seq=1 Ack=801 Win=65152 Len=0 TSval=2015027519 TSecr=3857209778"
"44","20.068947648","192.168.64.3","192.168.64.2","TCP","108","49908  >  5000 [PSH, ACK] Seq=801 Ack=1 Win=64256 Len=40 TSval=3857210779 TSecr=2015027519"
"45","20.069084023","192.168.64.2","192.168.64.3","TCP","68","5000  >  49908 [ACK] Seq=1 Ack=841 Win=65152 Len=0 TSval=2015028521 TSecr=3857210779"
"46","21.074667789","192.168.64.3","192.168.64.2","TCP","108","49908  >  5000 [PSH, ACK] Seq=841 Ack=1 Win=64256 Len=40 TSval=3857211785 TSecr=2015028521"
"47","21.074850456","192.168.64.2","192.168.64.3","TCP","68","5000  >  49908 [ACK] Seq=1 Ack=881 Win=65152 Len=0 TSval=2015029526 TSecr=3857211785"
"48","22.077161041","192.168.64.3","192.168.64.2","TCP","108","49908  >  5000 [PSH, ACK] Seq=881 Ack=1 Win=64256 Len=40 TSval=3857212787 TSecr=2015029526"
"49","22.077289958","192.168.64.2","192.168.64.3","TCP","68","5000  >  49908 [ACK] Seq=1 Ack=921 Win=65152 Len=0 TSval=2015030529 TSecr=3857212787"
"50","23.082675185","192.168.64.3","192.168.64.2","TCP","108","49908  >  5000 [PSH, ACK] Seq=921 Ack=1 Win=64256 Len=40 TSval=3857213793 TSecr=2015030529"
"51","23.082797477","192.168.64.2","192.168.64.3","TCP","68","5000  >  49908 [ACK] Seq=1 Ack=961 Win=65152 Len=0 TSval=2015031534 TSecr=3857213793"
"52","24.087380952","192.168.64.3","192.168.64.2","TCP","108","49908  >  5000 [PSH, ACK] Seq=961 Ack=1 Win=64256 Len=40 TSval=3857214797 TSecr=2015031534"
"53","24.087488119","192.168.64.2","192.168.64.3","TCP","68","5000  >  49908 [ACK] Seq=1 Ack=1001 Win=65152 Len=0 TSval=2015032539 TSecr=3857214797"
"54","25.093187060","192.168.64.3","192.168.64.2","TCP","108","49908  >  5000 [PSH, ACK] Seq=1001 Ack=1 Win=64256 Len=40 TSval=3857215803 TSecr=2015032539"
"55","25.093317561","192.168.64.2","192.168.64.3","TCP","68","5000  >  49908 [ACK] Seq=1 Ack=1041 Win=65152 Len=0 TSval=2015033545 TSecr=3857215803"
"56","26.095769987","192.168.64.3","192.168.64.2","TCP","108","49908  >  5000 [PSH, ACK] Seq=1041 Ack=1 Win=64256 Len=40 TSval=3857216806 TSecr=2015033545"
"57","26.095878404","192.168.64.2","192.168.64.3","TCP","68","5000  >  49908 [ACK] Seq=1 Ack=1081 Win=65152 Len=0 TSval=2015034547 TSecr=3857216806"
"58","27.100870970","192.168.64.3","192.168.64.2","TCP","108","49908  >  5000 [PSH, ACK] Seq=1081 Ack=1 Win=64256 Len=40 TSval=3857217811 TSecr=2015034547"
"59","27.100972596","192.168.64.2","192.168.64.3","TCP","68","5000  >  49908 [ACK] Seq=1 Ack=1121 Win=65152 Len=0 TSval=2015035553 TSecr=3857217811"
"60","28.102552396","192.168.64.3","192.168.64.2","TCP","108","49908  >  5000 [PSH, ACK] Seq=1121 Ack=1 Win=64256 Len=40 TSval=3857218812 TSecr=2015035553"
"61","28.102675689","192.168.64.2","192.168.64.3","TCP","68","5000  >  49908 [ACK] Seq=1 Ack=1161 Win=65152 Len=0 TSval=2015036554 TSecr=3857218812"
"62","29.104551034","192.168.64.3","192.168.64.2","TCP","108","49908  >  5000 [PSH, ACK] Seq=1161 Ack=1 Win=64256 Len=40 TSval=3857219814 TSecr=2015036554"
"63","29.104633368","192.168.64.2","192.168.64.3","TCP","68","5000  >  49908 [ACK] Seq=1 Ack=1201 Win=65152 Len=0 TSval=2015037556 TSecr=3857219814"
"64","30.106225506","192.168.64.3","192.168.64.2","TCP","108","49908  >  5000 [PSH, ACK] Seq=1201 Ack=1 Win=64256 Len=40 TSval=3857220815 TSecr=2015037556"
"65","30.106354423","192.168.64.2","192.168.64.3","TCP","68","5000  >  49908 [ACK] Seq=1 Ack=1241 Win=65152 Len=0 TSval=2015038558 TSecr=3857220815"
"66","31.110624159","192.168.64.3","192.168.64.2","TCP","108","49908  >  5000 [PSH, ACK] Seq=1241 Ack=1 Win=64256 Len=40 TSval=3857221820 TSecr=2015038558"
"67","31.110739785","192.168.64.2","192.168.64.3","TCP","68","5000  >  49908 [ACK] Seq=1 Ack=1281 Win=65152 Len=0 TSval=2015039562 TSecr=3857221820"
"68","32.112148592","192.168.64.3","192.168.64.2","TCP","108","49908  >  5000 [PSH, ACK] Seq=1281 Ack=1 Win=64256 Len=40 TSval=3857222821 TSecr=2015039562"
"69","32.112239093","192.168.64.2","192.168.64.3","TCP","68","5000  >  49908 [ACK] Seq=1 Ack=1321 Win=65152 Len=0 TSval=2015040564 TSecr=3857222821"
"70","33.113777193","192.168.64.3","192.168.64.2","TCP","108","49908  >  5000 [PSH, ACK] Seq=1321 Ack=1 Win=64256 Len=40 TSval=3857223823 TSecr=2015040564"
"71","33.113895777","192.168.64.2","192.168.64.3","TCP","68","5000  >  49908 [ACK] Seq=1 Ack=1361 Win=65152 Len=0 TSval=2015041565 TSecr=3857223823"
"72","34.117603975","192.168.64.3","192.168.64.2","TCP","108","49908  >  5000 [PSH, ACK] Seq=1361 Ack=1 Win=64256 Len=40 TSval=3857224827 TSecr=2015041565"
"73","34.117686267","192.168.64.2","192.168.64.3","TCP","68","5000  >  49908 [ACK] Seq=1 Ack=1401 Win=65152 Len=0 TSval=2015042569 TSecr=3857224827"
"74","35.121238048","192.168.64.3","192.168.64.2","TCP","108","49908  >  5000 [PSH, ACK] Seq=1401 Ack=1 Win=64256 Len=40 TSval=3857225830 TSecr=2015042569"
"75","35.121361048","192.168.64.2","192.168.64.3","TCP","68","5000  >  49908 [ACK] Seq=1 Ack=1441 Win=65152 Len=0 TSval=2015043573 TSecr=3857225830"
"76","36.123997368","192.168.64.3","192.168.64.2","TCP","108","49908  >  5000 [PSH, ACK] Seq=1441 Ack=1 Win=64256 Len=40 TSval=3857226833 TSecr=2015043573"
"77","36.124133869","192.168.64.2","192.168.64.3","TCP","68","5000  >  49908 [ACK] Seq=1 Ack=1481 Win=65152 Len=0 TSval=2015044576 TSecr=3857226833"
"78","37.125508893","192.168.64.3","192.168.64.2","TCP","108","49908  >  5000 [PSH, ACK] Seq=1481 Ack=1 Win=64256 Len=40 TSval=3857227834 TSecr=2015044576"
"79","37.125646685","192.168.64.2","192.168.64.3","TCP","68","5000  >  49908 [ACK] Seq=1 Ack=1521 Win=65152 Len=0 TSval=2015045577 TSecr=3857227834"
"80","38.131363441","192.168.64.3","192.168.64.2","TCP","108","49908  >  5000 [PSH, ACK] Seq=1521 Ack=1 Win=64256 Len=40 TSval=3857228840 TSecr=2015045577"
"81","38.131537400","192.168.64.2","192.168.64.3","TCP","68","5000  >  49908 [ACK] Seq=1 Ack=1561 Win=65152 Len=0 TSval=2015046583 TSecr=3857228840"
"82","39.135653565","192.168.64.3","192.168.64.2","TCP","108","49908  >  5000 [PSH, ACK] Seq=1561 Ack=1 Win=64256 Len=40 TSval=3857229844 TSecr=2015046583"
"83","39.135746816","192.168.64.2","192.168.64.3","TCP","68","5000  >  49908 [ACK] Seq=1 Ack=1601 Win=65152 Len=0 TSval=2015047587 TSecr=3857229844"
"84","40.138419476","192.168.64.3","192.168.64.2","TCP","108","49908  >  5000 [PSH, ACK] Seq=1601 Ack=1 Win=64256 Len=40 TSval=3857230847 TSecr=2015047587"
"85","40.138461309","192.168.64.2","192.168.64.3","TCP","68","5000  >  49908 [ACK] Seq=1 Ack=1641 Win=65152 Len=0 TSval=2015048590 TSecr=3857230847"
"86","41.143808651","192.168.64.3","192.168.64.2","TCP","108","49908  >  5000 [PSH, ACK] Seq=1641 Ack=1 Win=64256 Len=40 TSval=3857231852 TSecr=2015048590"
"87","41.143925235","192.168.64.2","192.168.64.3","TCP","68","5000  >  49908 [ACK] Seq=1 Ack=1681 Win=65152 Len=0 TSval=2015049596 TSecr=3857231852"
"88","42.145157724","192.168.64.3","192.168.64.2","TCP","108","49908  >  5000 [PSH, ACK] Seq=1681 Ack=1 Win=64256 Len=40 TSval=3857232853 TSecr=2015049596"
"89","42.145258391","192.168.64.2","192.168.64.3","TCP","68","5000  >  49908 [ACK] Seq=1 Ack=1721 Win=65152 Len=0 TSval=2015050597 TSecr=3857232853"
"90","43.147505595","192.168.64.3","192.168.64.2","TCP","108","49908  >  5000 [PSH, ACK] Seq=1721 Ack=1 Win=64256 Len=40 TSval=3857233856 TSecr=2015050597"
"91","43.147622137","192.168.64.2","192.168.64.3","TCP","68","5000  >  49908 [ACK] Seq=1 Ack=1761 Win=65152 Len=0 TSval=2015051599 TSecr=3857233856"
"92","44.152577398","192.168.64.3","192.168.64.2","TCP","108","49908  >  5000 [PSH, ACK] Seq=1761 Ack=1 Win=64256 Len=40 TSval=3857234861 TSecr=2015051599"
"93","44.152716982","192.168.64.2","192.168.64.3","TCP","68","5000  >  49908 [ACK] Seq=1 Ack=1801 Win=65152 Len=0 TSval=2015052604 TSecr=3857234861"
"94","45.156588488","192.168.64.3","192.168.64.2","TCP","108","49908  >  5000 [PSH, ACK] Seq=1801 Ack=1 Win=64256 Len=40 TSval=3857235865 TSecr=2015052604"
"95","45.156647697","192.168.64.2","192.168.64.3","TCP","68","5000  >  49908 [ACK] Seq=1 Ack=1841 Win=65152 Len=0 TSval=2015053608 TSecr=3857235865"
"96","46.161988963","192.168.64.3","192.168.64.2","TCP","108","49908  >  5000 [PSH, ACK] Seq=1841 Ack=1 Win=64256 Len=40 TSval=3857236870 TSecr=2015053608"
"97","46.162116880","192.168.64.2","192.168.64.3","TCP","68","5000  >  49908 [ACK] Seq=1 Ack=1881 Win=65152 Len=0 TSval=2015054614 TSecr=3857236870"
"98","47.166147432","192.168.64.3","192.168.64.2","TCP","108","49908  >  5000 [PSH, ACK] Seq=1881 Ack=1 Win=64256 Len=40 TSval=3857237874 TSecr=2015054614"
"99","47.166281974","192.168.64.2","192.168.64.3","TCP","68","5000  >  49908 [ACK] Seq=1 Ack=1921 Win=65152 Len=0 TSval=2015055618 TSecr=3857237874"
"100","48.169463690","192.168.64.3","192.168.64.2","TCP","108","49908  >  5000 [PSH, ACK] Seq=1921 Ack=1 Win=64256 Len=40 TSval=3857238877 TSecr=2015055618"
"101","48.169569815","192.168.64.2","192.168.64.3","TCP","68","5000  >  49908 [ACK] Seq=1 Ack=1961 Win=65152 Len=0 TSval=2015056621 TSecr=3857238877"
"102","49.171682319","192.168.64.3","192.168.64.2","TCP","108","49908  >  5000 [PSH, ACK] Seq=1961 Ack=1 Win=64256 Len=40 TSval=3857239879 TSecr=2015056621"
"103","49.171830069","192.168.64.2","192.168.64.3","TCP","68","5000  >  49908 [ACK] Seq=1 Ack=2001 Win=65152 Len=0 TSval=2015057623 TSecr=3857239879"
"104","50.174613494","192.168.64.3","192.168.64.2","TCP","108","49908  >  5000 [PSH, ACK] Seq=2001 Ack=1 Win=64256 Len=40 TSval=3857240883 TSecr=2015057623"
"105","50.174671369","192.168.64.2","192.168.64.3","TCP","68","5000  >  49908 [ACK] Seq=1 Ack=2041 Win=65152 Len=0 TSval=2015058626 TSecr=3857240883"
"106","51.180913855","192.168.64.3","192.168.64.2","TCP","108","49908  >  5000 [PSH, ACK] Seq=2041 Ack=1 Win=64256 Len=40 TSval=3857241888 TSecr=2015058626"
"107","51.181051814","192.168.64.2","192.168.64.3","TCP","68","5000  >  49908 [ACK] Seq=1 Ack=2081 Win=65152 Len=0 TSval=2015059633 TSecr=3857241888"
"108","52.184819746","192.168.64.3","192.168.64.2","TCP","108","49908  >  5000 [PSH, ACK] Seq=2081 Ack=1 Win=64256 Len=40 TSval=3857242892 TSecr=2015059633"
"109","52.184924455","192.168.64.2","192.168.64.3","TCP","68","5000  >  49908 [ACK] Seq=1 Ack=2121 Win=65152 Len=0 TSval=2015060637 TSecr=3857242892"
"110","53.188710347","192.168.64.3","192.168.64.2","TCP","108","49908  >  5000 [PSH, ACK] Seq=2121 Ack=1 Win=64256 Len=40 TSval=3857243896 TSecr=2015060637"
"111","53.188843889","192.168.64.2","192.168.64.3","TCP","68","5000  >  49908 [ACK] Seq=1 Ack=2161 Win=65152 Len=0 TSval=2015061640 TSecr=3857243896"
"112","54.193379036","192.168.64.3","192.168.64.2","TCP","108","49908  >  5000 [PSH, ACK] Seq=2161 Ack=1 Win=64256 Len=40 TSval=3857244901 TSecr=2015061640"
"113","54.193478495","192.168.64.2","192.168.64.3","TCP","68","5000  >  49908 [ACK] Seq=1 Ack=2201 Win=65152 Len=0 TSval=2015062645 TSecr=3857244901"
"114","55.197959976","192.168.64.3","192.168.64.2","TCP","108","49908  >  5000 [PSH, ACK] Seq=2201 Ack=1 Win=64256 Len=40 TSval=3857245905 TSecr=2015062645"
"115","55.198090268","192.168.64.2","192.168.64.3","TCP","68","5000  >  49908 [ACK] Seq=1 Ack=2241 Win=65152 Len=0 TSval=2015063650 TSecr=3857245905"
"116","56.200344156","192.168.64.3","192.168.64.2","TCP","108","49908  >  5000 [PSH, ACK] Seq=2241 Ack=1 Win=64256 Len=40 TSval=3857246907 TSecr=2015063650"
"117","56.200535115","192.168.64.2","192.168.64.3","TCP","68","5000  >  49908 [ACK] Seq=1 Ack=2281 Win=65152 Len=0 TSval=2015064652 TSecr=3857246907"
"118","57.201732666","192.168.64.3","192.168.64.2","TCP","108","49908  >  5000 [PSH, ACK] Seq=2281 Ack=1 Win=64256 Len=40 TSval=3857247909 TSecr=2015064652"
"119","57.201868708","192.168.64.2","192.168.64.3","TCP","68","5000  >  49908 [ACK] Seq=1 Ack=2321 Win=65152 Len=0 TSval=2015065653 TSecr=3857247909"
"120","58.205588856","192.168.64.3","192.168.64.2","TCP","108","49908  >  5000 [PSH, ACK] Seq=2321 Ack=1 Win=64256 Len=40 TSval=3857248912 TSecr=2015065653"
"121","58.205689689","192.168.64.2","192.168.64.3","TCP","68","5000  >  49908 [ACK] Seq=1 Ack=2361 Win=65152 Len=0 TSval=2015066657 TSecr=3857248912"
"122","59.207413786","192.168.64.3","192.168.64.2","TCP","108","49908  >  5000 [PSH, ACK] Seq=2361 Ack=1 Win=64256 Len=40 TSval=3857249914 TSecr=2015066657"
"123","59.207535245","192.168.64.2","192.168.64.3","TCP","68","5000  >  49908 [ACK] Seq=1 Ack=2401 Win=65152 Len=0 TSval=2015067659 TSecr=3857249914"
"124","60.209418136","192.168.64.3","192.168.64.2","TCP","108","49908  >  5000 [PSH, ACK] Seq=2401 Ack=1 Win=64256 Len=40 TSval=3857250916 TSecr=2015067659"
"125","60.209548178","192.168.64.2","192.168.64.3","TCP","68","5000  >  49908 [ACK] Seq=1 Ack=2441 Win=65152 Len=0 TSval=2015068661 TSecr=3857250916"
"126","61.213566164","192.168.64.3","192.168.64.2","TCP","108","49908  >  5000 [PSH, ACK] Seq=2441 Ack=1 Win=64256 Len=40 TSval=3857251920 TSecr=2015068661"
"127","61.213645456","192.168.64.2","192.168.64.3","TCP","68","5000  >  49908 [ACK] Seq=1 Ack=2481 Win=65152 Len=0 TSval=2015069665 TSecr=3857251920"
"128","62.217209149","192.168.64.3","192.168.64.2","TCP","108","49908  >  5000 [PSH, ACK] Seq=2481 Ack=1 Win=64256 Len=40 TSval=3857252924 TSecr=2015069665"
"129","62.217325275","192.168.64.2","192.168.64.3","TCP","68","5000  >  49908 [ACK] Seq=1 Ack=2521 Win=65152 Len=0 TSval=2015070669 TSecr=3857252924"
"130","63.219323794","192.168.64.3","192.168.64.2","TCP","108","49908  >  5000 [PSH, ACK] Seq=2521 Ack=1 Win=64256 Len=40 TSval=3857253926 TSecr=2015070669"
"131","63.219465670","192.168.64.2","192.168.64.3","TCP","68","5000  >  49908 [ACK] Seq=1 Ack=2561 Win=65152 Len=0 TSval=2015071671 TSecr=3857253926"
"132","64.223465617","192.168.64.3","192.168.64.2","TCP","108","49908  >  5000 [PSH, ACK] Seq=2561 Ack=1 Win=64256 Len=40 TSval=3857254930 TSecr=2015071671"
"133","64.223587951","192.168.64.2","192.168.64.3","TCP","68","5000  >  49908 [ACK] Seq=1 Ack=2601 Win=65152 Len=0 TSval=2015072675 TSecr=3857254930"
"134","65.225624389","192.168.64.3","192.168.64.2","TCP","108","49908  >  5000 [PSH, ACK] Seq=2601 Ack=1 Win=64256 Len=40 TSval=3857255932 TSecr=2015072675"
"135","65.225752473","192.168.64.2","192.168.64.3","TCP","68","5000  >  49908 [ACK] Seq=1 Ack=2641 Win=65152 Len=0 TSval=2015073677 TSecr=3857255932"
"136","66.228155914","192.168.64.3","192.168.64.2","TCP","108","49908  >  5000 [PSH, ACK] Seq=2641 Ack=1 Win=64256 Len=40 TSval=3857256934 TSecr=2015073677"
"137","66.228338749","192.168.64.2","192.168.64.3","TCP","68","5000  >  49908 [ACK] Seq=1 Ack=2681 Win=65152 Len=0 TSval=2015074680 TSecr=3857256934"
"138","67.231414111","192.168.64.3","192.168.64.2","TCP","108","49908  >  5000 [PSH, ACK] Seq=2681 Ack=1 Win=64256 Len=40 TSval=3857257938 TSecr=2015074680"
"139","67.231520486","192.168.64.2","192.168.64.3","TCP","68","5000  >  49908 [ACK] Seq=1 Ack=2721 Win=65152 Len=0 TSval=2015075683 TSecr=3857257938"
"140","68.235451688","192.168.64.3","192.168.64.2","TCP","108","49908  >  5000 [PSH, ACK] Seq=2721 Ack=1 Win=64256 Len=40 TSval=3857258941 TSecr=2015075683"
"141","68.235583480","192.168.64.2","192.168.64.3","TCP","68","5000  >  49908 [ACK] Seq=1 Ack=2761 Win=65152 Len=0 TSval=2015076687 TSecr=3857258941"
"142","69.239711891","192.168.64.3","192.168.64.2","TCP","108","49908  >  5000 [PSH, ACK] Seq=2761 Ack=1 Win=64256 Len=40 TSval=3857259946 TSecr=2015076687"
"143","69.239998726","192.168.64.2","192.168.64.3","TCP","68","5000  >  49908 [ACK] Seq=1 Ack=2801 Win=65152 Len=0 TSval=2015077691 TSecr=3857259946"
"144","70.243032966","192.168.64.3","192.168.64.2","TCP","108","49908  >  5000 [PSH, ACK] Seq=2801 Ack=1 Win=64256 Len=40 TSval=3857260949 TSecr=2015077691"
"145","70.243163217","192.168.64.2","192.168.64.3","TCP","68","5000  >  49908 [ACK] Seq=1 Ack=2841 Win=65152 Len=0 TSval=2015078695 TSecr=3857260949"
"146","71.245251745","192.168.64.3","192.168.64.2","TCP","108","49908  >  5000 [PSH, ACK] Seq=2841 Ack=1 Win=64256 Len=40 TSval=3857261951 TSecr=2015078695"
"147","71.245384162","192.168.64.2","192.168.64.3","TCP","68","5000  >  49908 [ACK] Seq=1 Ack=2881 Win=65152 Len=0 TSval=2015079697 TSecr=3857261951"
"148","72.246708479","192.168.64.3","192.168.64.2","TCP","108","49908  >  5000 [PSH, ACK] Seq=2881 Ack=1 Win=64256 Len=40 TSval=3857262952 TSecr=2015079697"
"149","72.246800937","192.168.64.2","192.168.64.3","TCP","68","5000  >  49908 [ACK] Seq=1 Ack=2921 Win=65152 Len=0 TSval=2015080698 TSecr=3857262952"
"150","73.249120760","192.168.64.3","192.168.64.2","TCP","108","49908  >  5000 [PSH, ACK] Seq=2921 Ack=1 Win=64256 Len=40 TSval=3857263955 TSecr=2015080698"
"151","73.249167677","192.168.64.2","192.168.64.3","TCP","68","5000  >  49908 [ACK] Seq=1 Ack=2961 Win=65152 Len=0 TSval=2015081701 TSecr=3857263955"
"152","74.253318176","192.168.64.3","192.168.64.2","TCP","108","49908  >  5000 [PSH, ACK] Seq=2961 Ack=1 Win=64256 Len=40 TSval=3857264959 TSecr=2015081701"
"153","74.253432344","192.168.64.2","192.168.64.3","TCP","68","5000  >  49908 [ACK] Seq=1 Ack=3001 Win=65152 Len=0 TSval=2015082705 TSecr=3857264959"
"154","75.254861497","192.168.64.3","192.168.64.2","TCP","108","49908  >  5000 [PSH, ACK] Seq=3001 Ack=1 Win=64256 Len=40 TSval=3857265960 TSecr=2015082705"
"155","75.254997122","192.168.64.2","192.168.64.3","TCP","68","5000  >  49908 [ACK] Seq=1 Ack=3041 Win=65152 Len=0 TSval=2015083707 TSecr=3857265960"
"156","76.258985498","192.168.64.3","192.168.64.2","TCP","108","49908  >  5000 [PSH, ACK] Seq=3041 Ack=1 Win=64256 Len=40 TSval=3857266964 TSecr=2015083707"
"157","76.259114748","192.168.64.2","192.168.64.3","TCP","68","5000  >  49908 [ACK] Seq=1 Ack=3081 Win=65152 Len=0 TSval=2015084711 TSecr=3857266964"
"158","77.261087448","192.168.64.3","192.168.64.2","TCP","108","49908  >  5000 [PSH, ACK] Seq=3081 Ack=1 Win=64256 Len=40 TSval=3857267967 TSecr=2015084711"
"159","77.261149115","192.168.64.2","192.168.64.3","TCP","68","5000  >  49908 [ACK] Seq=1 Ack=3121 Win=65152 Len=0 TSval=2015085713 TSecr=3857267967"
"160","78.262670521","192.168.64.3","192.168.64.2","TCP","108","49908  >  5000 [PSH, ACK] Seq=3121 Ack=1 Win=64256 Len=40 TSval=3857268968 TSecr=2015085713"
"161","78.262715146","192.168.64.2","192.168.64.3","TCP","68","5000  >  49908 [ACK] Seq=1 Ack=3161 Win=65152 Len=0 TSval=2015086714 TSecr=3857268968"
"162","79.264951182","192.168.64.3","192.168.64.2","TCP","108","49908  >  5000 [PSH, ACK] Seq=3161 Ack=1 Win=64256 Len=40 TSval=3857269970 TSecr=2015086714"
"163","79.265064516","192.168.64.2","192.168.64.3","TCP","68","5000  >  49908 [ACK] Seq=1 Ack=3201 Win=65152 Len=0 TSval=2015087717 TSecr=3857269970"
"164","80.267070468","192.168.64.3","192.168.64.2","TCP","108","49908  >  5000 [PSH, ACK] Seq=3201 Ack=1 Win=64256 Len=40 TSval=3857270972 TSecr=2015087717"
"165","80.267176635","192.168.64.2","192.168.64.3","TCP","68","5000  >  49908 [ACK] Seq=1 Ack=3241 Win=65152 Len=0 TSval=2015088719 TSecr=3857270972"
"166","81.270973472","192.168.64.3","192.168.64.2","TCP","108","49908  >  5000 [PSH, ACK] Seq=3241 Ack=1 Win=64256 Len=40 TSval=3857271976 TSecr=2015088719"
"167","81.271088056","192.168.64.2","192.168.64.3","TCP","68","5000  >  49908 [ACK] Seq=1 Ack=3281 Win=65152 Len=0 TSval=2015089723 TSecr=3857271976"
"168","82.273611720","192.168.64.3","192.168.64.2","TCP","108","49908  >  5000 [PSH, ACK] Seq=3281 Ack=1 Win=64256 Len=40 TSval=3857272979 TSecr=2015089723"
"169","82.273686762","192.168.64.2","192.168.64.3","TCP","68","5000  >  49908 [ACK] Seq=1 Ack=3321 Win=65152 Len=0 TSval=2015090725 TSecr=3857272979"
"170","83.275672342","192.168.64.3","192.168.64.2","TCP","108","49908  >  5000 [PSH, ACK] Seq=3321 Ack=1 Win=64256 Len=40 TSval=3857273980 TSecr=2015090725"
"171","83.275773217","192.168.64.2","192.168.64.3","TCP","68","5000  >  49908 [ACK] Seq=1 Ack=3361 Win=65152 Len=0 TSval=2015091727 TSecr=3857273980"
"172","84.279376097","192.168.64.3","192.168.64.2","TCP","108","49908  >  5000 [PSH, ACK] Seq=3361 Ack=1 Win=64256 Len=40 TSval=3857274984 TSecr=2015091727"
"173","84.279510931","192.168.64.2","192.168.64.3","TCP","68","5000  >  49908 [ACK] Seq=1 Ack=3401 Win=65152 Len=0 TSval=2015092731 TSecr=3857274984"
"174","85.283319771","192.168.64.3","192.168.64.2","TCP","108","49908  >  5000 [PSH, ACK] Seq=3401 Ack=1 Win=64256 Len=40 TSval=3857275988 TSecr=2015092731"
"175","85.283471064","192.168.64.2","192.168.64.3","TCP","68","5000  >  49908 [ACK] Seq=1 Ack=3441 Win=65152 Len=0 TSval=2015093735 TSecr=3857275988"
"176","86.285066893","192.168.64.3","192.168.64.2","TCP","108","49908  >  5000 [PSH, ACK] Seq=3441 Ack=1 Win=64256 Len=40 TSval=3857276989 TSecr=2015093735"
"177","86.285193602","192.168.64.2","192.168.64.3","TCP","68","5000  >  49908 [ACK] Seq=1 Ack=3481 Win=65152 Len=0 TSval=2015094737 TSecr=3857276989"
"178","87.288883318","192.168.64.3","192.168.64.2","TCP","108","49908  >  5000 [PSH, ACK] Seq=3481 Ack=1 Win=64256 Len=40 TSval=3857277993 TSecr=2015094737"
"179","87.289011236","192.168.64.2","192.168.64.3","TCP","68","5000  >  49908 [ACK] Seq=1 Ack=3521 Win=65152 Len=0 TSval=2015095741 TSecr=3857277993"
"180","88.291122694","192.168.64.3","192.168.64.2","TCP","108","49908  >  5000 [PSH, ACK] Seq=3521 Ack=1 Win=64256 Len=40 TSval=3857278995 TSecr=2015095741"
"181","88.291251195","192.168.64.2","192.168.64.3","TCP","68","5000  >  49908 [ACK] Seq=1 Ack=3561 Win=65152 Len=0 TSval=2015096743 TSecr=3857278995"
"182","89.295028320","192.168.64.3","192.168.64.2","TCP","108","49908  >  5000 [PSH, ACK] Seq=3561 Ack=1 Win=64256 Len=40 TSval=3857279999 TSecr=2015096743"
"183","89.295183071","192.168.64.2","192.168.64.3","TCP","68","5000  >  49908 [ACK] Seq=1 Ack=3601 Win=65152 Len=0 TSval=2015097747 TSecr=3857279999"
"184","90.298618762","192.168.64.3","192.168.64.2","TCP","108","49908  >  5000 [PSH, ACK] Seq=3601 Ack=1 Win=64256 Len=40 TSval=3857281003 TSecr=2015097747"
"185","90.298800048","192.168.64.2","192.168.64.3","TCP","68","5000  >  49908 [ACK] Seq=1 Ack=3641 Win=65152 Len=0 TSval=2015098750 TSecr=3857281003"
"186","91.300051773","192.168.64.3","192.168.64.2","TCP","108","49908  >  5000 [PSH, ACK] Seq=3641 Ack=1 Win=64256 Len=40 TSval=3857282004 TSecr=2015098750"
"187","91.300168395","192.168.64.2","192.168.64.3","TCP","68","5000  >  49908 [ACK] Seq=1 Ack=3681 Win=65152 Len=0 TSval=2015099752 TSecr=3857282004"
"188","92.302430167","192.168.64.3","192.168.64.2","TCP","108","49908  >  5000 [PSH, ACK] Seq=3681 Ack=1 Win=64256 Len=40 TSval=3857283007 TSecr=2015099752"
"189","92.302547830","192.168.64.2","192.168.64.3","TCP","68","5000  >  49908 [ACK] Seq=1 Ack=3721 Win=65152 Len=0 TSval=2015100754 TSecr=3857283007"
"190","93.305954690","192.168.64.3","192.168.64.2","TCP","108","49908  >  5000 [PSH, ACK] Seq=3721 Ack=1 Win=64256 Len=40 TSval=3857284010 TSecr=2015100754"
"191","93.306054145","192.168.64.2","192.168.64.3","TCP","68","5000  >  49908 [ACK] Seq=1 Ack=3761 Win=65152 Len=0 TSval=2015101758 TSecr=3857284010"
"192","94.307448352","192.168.64.3","192.168.64.2","TCP","108","49908  >  5000 [PSH, ACK] Seq=3761 Ack=1 Win=64256 Len=40 TSval=3857285011 TSecr=2015101758"
"193","94.307534266","192.168.64.2","192.168.64.3","TCP","68","5000  >  49908 [ACK] Seq=1 Ack=3801 Win=65152 Len=0 TSval=2015102759 TSecr=3857285011"
"194","95.310554542","192.168.64.3","192.168.64.2","TCP","108","49908  >  5000 [PSH, ACK] Seq=3801 Ack=1 Win=64256 Len=40 TSval=3857286014 TSecr=2015102759"
"195","95.310675580","192.168.64.2","192.168.64.3","TCP","68","5000  >  49908 [ACK] Seq=1 Ack=3841 Win=65152 Len=0 TSval=2015103762 TSecr=3857286014"
"196","96.312145653","192.168.64.3","192.168.64.2","TCP","108","49908  >  5000 [PSH, ACK] Seq=3841 Ack=1 Win=64256 Len=40 TSval=3857287016 TSecr=2015103762"
"197","96.312293648","192.168.64.2","192.168.64.3","TCP","68","5000  >  49908 [ACK] Seq=1 Ack=3881 Win=65152 Len=0 TSval=2015104764 TSecr=3857287016"
"198","97.313926537","192.168.64.3","192.168.64.2","TCP","108","49908  >  5000 [PSH, ACK] Seq=3881 Ack=1 Win=64256 Len=40 TSval=3857288018 TSecr=2015104764"
"199","97.314024326","192.168.64.2","192.168.64.3","TCP","68","5000  >  49908 [ACK] Seq=1 Ack=3921 Win=65152 Len=0 TSval=2015105766 TSecr=3857288018"
"200","98.315245372","192.168.64.3","192.168.64.2","TCP","108","49908  >  5000 [PSH, ACK] Seq=3921 Ack=1 Win=64256 Len=40 TSval=3857289019 TSecr=2015105766"
"201","98.315372702","192.168.64.2","192.168.64.3","TCP","68","5000  >  49908 [ACK] Seq=1 Ack=3961 Win=65152 Len=0 TSval=2015106767 TSecr=3857289019"
"202","99.316423446","192.168.64.3","192.168.64.2","TCP","108","49908  >  5000 [PSH, ACK] Seq=3961 Ack=1 Win=64256 Len=40 TSval=3857290020 TSecr=2015106767"
"203","99.316491694","192.168.64.2","192.168.64.3","TCP","68","5000  >  49908 [ACK] Seq=1 Ack=4001 Win=65152 Len=0 TSval=2015107768 TSecr=3857290020"
"204","100.319192468","192.168.64.3","192.168.64.2","TCP","108","49908  >  5000 [PSH, ACK] Seq=4001 Ack=1 Win=64256 Len=40 TSval=3857291023 TSecr=2015107768"
"205","100.319291965","192.168.64.2","192.168.64.3","TCP","68","5000  >  49908 [ACK] Seq=1 Ack=4041 Win=65152 Len=0 TSval=2015108771 TSecr=3857291023"
"206","101.322821197","192.168.64.3","192.168.64.2","TCP","77","49908  >  5000 [PSH, ACK] Seq=4041 Ack=1 Win=64256 Len=9 TSval=3857292026 TSecr=2015108771"
"207","101.322960068","192.168.64.2","192.168.64.3","TCP","68","5000  >  49908 [ACK] Seq=1 Ack=4050 Win=65152 Len=0 TSval=2015109775 TSecr=3857292026"
"208","102.326459861","192.168.64.3","192.168.64.2","TCP","68","49908  >  5000 [FIN, ACK] Seq=4050 Ack=1 Win=64256 Len=0 TSval=3857293030 TSecr=2015109775"
"209","102.326967347","192.168.64.2","192.168.64.3","TCP","68","5000  >  49908 [FIN, ACK] Seq=1 Ack=4051 Win=65152 Len=0 TSval=2015110779 TSecr=3857293030"
"210","102.328336101","192.168.64.3","192.168.64.2","TCP","68","49908  >  5000 [ACK] Seq=4051 Ack=2 Win=64256 Len=0 TSval=3857293032 TSecr=2015110779"
